"video_id","video_title","view_count","category","duration_in_seconds","upload_time","captured_time","avg_rate","max_rate","min_rate","num_raters","num_dislikes","num_likes","uploader_id","uploader_name","uploader_url","video_desp"
"J04WGGIAjDE","THE PROFESSIONALS - S1E11:  Special Request ","808609","Comedy","739","2010-05-27T16:44:15.000Z","01/18/13","4.7483797","5.0","1.0","20523","1291","19232","jQEYy8YJc9eWjNUGk5p9ig","TheProfessionalsShow","https://gdata.youtube.com/feeds/api/users/TheProfessionalsShow","***Featuring RAY WILLIAM JOHNSON!!!***  Now that Tim and Frank are partners again, it's back to the usual grind. However, a new client arrives to shake things up. Meanwhile, The Boss eagerly awaits the delivery of a package.  Get a T-Shirt!  http://www.districtlines.com/the-professionals  LINKS http://facebook.com/TheProfessionalsShow - LIKE US! http://twitter.com/TheProfShow - FOLLOW US!  Check out this interview we did with NerdBlerp.com! http://www.nerdblerp.com/story/2010-05-20-nerd-blerp-interview-the-professionals  *We are NOT sponsored by Apple! The location we shoot at is a legit Help Desk that has all of those iMacs, which all run Windows. Did no one notice the Dell with the finger in it? Or The Boss's IBM ThinkCentre? Also, even though it's hard to see, the iMac with the virus on it is running Windows.  **In real life, silencers don't sound like they do in Goldeneye. They're still pretty loud. Check this video of a real silenced gun: http://www.youtube.com/watch?v=zT8ccRwXUts"
"j54yGxuk0yo","7.00!!! OMG!!! NEW PB! OMG!! OMG!!! SO CLOSE TO SIX!! OOMMGG!!!","3779479","Sports","75","2008-10-13T02:46:24.000Z","01/18/13","4.759074","5.0","1.0","21600","1301","20299","9sj8iI2ZNWqft-Xwy9Jtnw","speedstackinggirl","https://gdata.youtube.com/feeds/api/users/speedstackinggirl","Official OMG Skrillex T-Shirts are available at SkrillexMerch.com. Check them out! This special video has been featured on RayWilliamJohnson, Tosh.0 (Comedy Central), Scary Monsters and Nice Sprites by Skrillex, Rock N Roll by Skrillex, Hey Sexy Lady Skrillex Remix by Skrillex, Doomed by Headhunterz, AOTS (Attack of The Show), Time Warp (Discovery Channel), and RudeTube (probably) collegehumor.com, The Soup, and other websites and YouTube videos (some Call of Duty videos especially XD)  ALSO! CHRISTINA GRIMMIE  (zeldaxlove64) COMMENTED ON THIS VIDEO ON 8/20/11!  Ian from Smosh Tweeted this video on 8/22/11! Link:  http://twitter.com/#!/SmoshIan/status/105571105070252034  Honor I discovered on 10/29/11:  #73 -- Most Discussed (All Time) -- Sports  Real Description:  I AM UNBELIEVING RIGHT NOW!! OMG OMG SO HAPPY!!! OMG!! OMG OMG!  I SAID OMG SO MANY TIMES!! (in the vid too)   and check it out. In the date and map thing. it says my video was recorded in the ocean :P. lol. I dragged it there.  10-13 #26 - Most Discussed (Today) - Sports #35 - Top Favorited (Today) - Sports #44 - Top Rated (Today) - Sports  10-14-08  #20 - Most Discussed (Today) - Sports #98 - Most Discussed (This Week) - Sports #55 - Most Viewed (Today) - Sports - New Zealand #21 - Top Favorited (Today) - Sports #28 - Top Rated (Today) - Sports  10-19-08 #86 - Most Discussed (This Week) - Sports  AND NO DISSING ON MY TIE-DYE SHIRT!! I MADE IT AND PUT TOO MUCH OF THE REALLY DARK COLOR IN IT! :)  AND FOR ALL OF YOU HATERS OUT THERE! I DO ALSO DO A  REAL  SPORT. TENNIS. IF YOU CAN SEE ALL MY TROPHIES IN THE TOP RIGHT CORNER. I AM RANKED 8TH IN OREGON FOR 13-14 YEAR OLDS. I also won state for tennis two years in a row.  Random tags: excited cup stacking girl crazy freak out fast amazing"
"j8Bc7eRTdWY","An Awkward Moment","11336776","News","25","2011-02-17T02:19:50.000Z","01/18/13","4.8979836","5.0","1.0","55991","1428","54563","sOcrfhLz6EHQj8EiZPuS_w","ten","https://gdata.youtube.com/feeds/api/users/ten","Belinda Heggen deals Mark Aiston a low blow. See more at www.tennews.com.au"
"j9LBLSL5gz0","Epic Cat Fail !!!","533366","Animals","24","2009-04-17T09:23:02.000Z","01/18/13","4.7464447","5.0","1.0","2461","156","2305","HwOBNJoaSbF8gG180e8jAw","DogsAnimalsCats","https://gdata.youtube.com/feeds/api/users/DogsAnimalsCats","This cat has not his caturday today!"
"jaAaCIrsaak","Weather man gives everyone the finger *original live version*","835638","News","38","2010-08-17T11:37:56.000Z","01/18/13","0.0","0.0","0.0","0","0","0","vjb70l-G5OxywfhaSsyJLg","dnh500","https://gdata.youtube.com/feeds/api/users/dnh500","idiot"
"ji5_MqicxSo","Randy Pausch Last Lecture: Achieving Your Childhood Dreams","15544716","Education","4587","2007-12-20T20:07:32.000Z","01/18/13","4.885737","5.0","1.0","70399","2011","68388","f-COwmdNelXvbj-KaMCuLw","CarnegieMellonU","https://gdata.youtube.com/feeds/api/users/CarnegieMellonU","Carnegie Mellon Professor Randy Pausch (Oct. 23, 1960 - July 25, 2008) gave his last lecture at the university Sept. 18, 2007, before a packed McConomy Auditorium. In his moving presentation,  Really Achieving Your Childhood Dreams,  Pausch talked about his lessons learned and gave advice to students on how to achieve their own career and personal goals.   For more on Randy, visit: http://www.cmu.edu/randyslecture  Learn how to support the Randy Pausch Memorial Bridge, visit: http://www.cmu.edu/homepage/images/extras/emails/pausch/pausch_bridge.html"
"jjXyqcx-mYY","Yes We Can - Barack Obama Music Video","24547302","News","270","2008-02-02T08:57:48.000Z","01/18/13","4.5388517","5.0","1.0","91051","10497","80554","9q505kh3scAkVaOBQzZkoA","WeCan08","https://gdata.youtube.com/feeds/api/users/WeCan08","Congratulations, Mr. President.    -Lyrics-  It was a creed written into the founding documents that declared the destiny of a nation.  Yes we can.  It was whispered by slaves and abolitionists as they blazed a trail toward freedom.  Yes we can.  It was sung by immigrants as they struck out from distant shores and pioneers who pushed westward against an unforgiving wilderness.  Yes we can.  It was the call of workers who organized; women who reached for the ballots; a President who chose the moon as our new frontier; and a King who took us to the mountaintop and pointed the way to the Promised Land.  Yes we can to justice and equality.  Yes we can to opportunity and prosperity.  Yes we can heal this nation.  Yes we can repair this world.  Yes we can.  We know the battle ahead will be long, but always remember that no matter what obstacles stand in our way, nothing can stand in the way of the power of millions of voices calling for change.  We have been told we cannot do this by a chorus of cynics...they will only grow louder and more dissonant ........... We've been asked to pause for a reality check. We've been warned against offering the people of this nation false hope.  But in the unlikely story that is America, there has never been anything false about hope.  Now the hopes of the little girl who goes to a crumbling school in Dillon are the same as the dreams of the boy who learns on the streets of LA; we will remember that there is something happening in America; that we are not as divided as our politics suggests; that we are one people; we are one nation; and together, we will begin the next great chapter in the American story with three words that will ring from coast to coast; from sea to shining sea --  Yes. We. Can.  Guest appearances -  will.i.am - 0:01  Scarlett Johansson - 0:05  Kareem Abdul-Jabbar - 0:21  Common - 0:23  John Legend - 0:32  Bryan Greenberg (guitar) - 0:37  Kate Walsh - 0:44  Tatyana Ali - 0:44  Harold Perrineau, Jr. - 0:49  Aisha Tyler - 1:01  Samuel Page - 1:03  Enrique Murciano - 1:07  Si, podemos  - 1:17  Maya Rubin - 1:08  כן אנו יכולים (Qen Annu Yecholim)  (Hebrew)  Esthero - 1:10  Eric Balfour - 1:23  Nicole Scherzinger - 1:30  Taryn Manning - 1:40  Amber Valletta - 1:52  Auden McCaw (in Valetta's arms) - 1:52  Kelly Hu - 1:52   Adam Rodríguez - 1:56  Sí se puede   Eric Christian Olsen - 2:02  Sarah Wright - 2:02  Shoshannah Stern (American Sign Language) - 2:05  Ed Kowalczyk (guitar) - 2:19  Fonzworth Bentley (violin) - 2:38  Amaury Nolasco - 3:24  Hill Harper - 3:27  Nick Cannon - 3:36  Herbie Hancock (piano) - 3:41  Johnathon Schaech - 3:45  Austin Nichols - 3:50  Tracee Ellis Ross - 4:00  Fred Goldring (guitar) - 4:03  Anson Mount  Alfonso Ribeiro  Cliff Collins  Vera Farmiga"
"jPETOynoev0","Kid wins contest","633501","News","43","2012-02-10T01:57:12.000Z","01/18/13","4.6580925","5.0","1.0","2527","216","2311","_9uFM0NnL-9yXS36gc4org","CenterOfNewYork","https://gdata.youtube.com/feeds/api/users/CenterOfNewYork","Kid wins contest"
"JpMwAHmnbS8","Young deer bathing kitty","974327","Animals","122","2009-07-15T01:11:45.000Z","01/18/13","4.9374638","5.0","1.0","3454","54","3400","Hmv7GrQH0SRUvMBKBIqaww","ArnoldsWildlifeRehab","https://gdata.youtube.com/feeds/api/users/ArnoldsWildlifeRehab","On a recent visit to Arnold's Wildlife Rehab (in Okeechobee, Florida), one of the young deer started bathing this kitty. Because it was just so sweet, I thought it was a great opportunity to let people know about this amazing facility. They do great work and they need support. Contact them if you'd like to make a donation. (Sorry for the talking in the background- this was an impromptu filming) www.arnoldswildlife.org"
"k-INUzgV_SY","The best cosplay of all time","5607182","People","26","2012-11-11T11:24:36.000Z","01/18/13","4.839937","5.0","1.0","30563","1223","29340","3V52-R4Ygri9bJY0vfGzEw","RayLiehm","https://gdata.youtube.com/feeds/api/users/RayLiehm","You know how, outside car yard sales, they'll have those big inflatable stick figure people who flap around? Well, right towards the end of Brisbane Supanova 2012, I ran into this guy. He had *everyone* in stitches. :D  UPDATE: Well now, this seems to have gained a little attention, hasn't it? I honestly can't believe the response to this video so far. At last check, it was about to clock 2 million views after having been uploaded for less than 3 days, which is incredible.  NEW UPDATE: Aaaaand this just got featured by Ray William Johnson: https://www.youtube.com/watch?v=H5xhdntSlo8 . This could make things interesting ^^;  ***  Of course, I'm just the person who was lucky enough to record this video and have it go viral. After a brief search, I am pleased to report that the man who has been keeping you all well entertained with his flailing performance is none other than:  Dennis Pereira (actor) - http://www.facebook.com/TheReaver  There are also a couple of others responsible for the creation of the costume, who can be contacted at a Facebook Fan Page set up following this video going viral:  Zoe King (concept) &  Sushi Slammer  (design & construction) - http://www.facebook.com/WackyWavingInflatableArmFlailingTubemanCosplay  ***  Some of the places this video has popped up over the last few days include:  * NineMSN: http://news.ninemsn.com.au/national/2012/11/13/05/27/man-impersonates-inflatable-stick-figure * BuzzFeed: http://www.buzzfeed.com/svoip/best-cosplay-of-all-time-4y59 * Reddit: http://ir.reddit.com/r/videos/comments/131h2r/best_cosplay_of_all_time/ * 9GAG: http://9gag.com/gag/5822997 * Trendolizer: http://www.trendolizer.com/2012/11/the-best-cosplay-of-all-time.html * Nova: http://www.novafm.com.au/video/funniest-costume-ever-goes-viral * Huffington Post: http://www.huffingtonpost.com/2012/11/13/the-best-cosplay-of-all-time-tube-man-video_n_2122917.html  And it's even in GIF form now: http://www.gifbay.com/gif/the_best_cosplay_of_all_time-11460/"
"K-SmfybCbsY","Javelin Missile In Afghanistan!","1601401","News","14","2010-09-10T21:26:07.000Z","01/18/13","4.935242","5.0","1.0","10686","173","10513","H0PN3DTNDZRjXezDyndVOA","Redheadfury","https://gdata.youtube.com/feeds/api/users/Redheadfury","ahahahahahaha"
"K2cYWfq--Nw","Daft Hands - Harder, Better, Faster, Stronger","55178708","Music","225","2007-06-07T04:01:44.000Z","01/18/13","4.85706","5.0","1.0","360599","12886","347713","0ec8Y7JbD5ZBxm_axuD0Gg","FrEckleStudios","https://gdata.youtube.com/feeds/api/users/FrEckleStudios","WANT A SHIRT? -  http://www.cafepress.com/frecklestudios --- Wait until after the awesome hand-jig and be amazed.  Now comes with blurriness AND the moment near the end where I fall over and kill my toes - but keep going! --- Let me clarify: This is all one take; there is no editing except the words at the beginning.  This is also the original.  These are my hands.  Thanks for all the positive feedback!"
"k9iOxL4C0u8"," I AM NOT A HIPSTER  Now on iTunes & iamnotahipster.com","1678415","People","62","2007-08-07T20:18:39.000Z","01/18/13","4.6704373","5.0","1.0","5304","437","4867","DF8gOuEbdPkg-Ls2zCpPBQ","flagpop","https://gdata.youtube.com/feeds/api/users/flagpop","NEW TRAILER!!! http://www.youtube.com/watch?v=e7pOGn-Qy7M"
"KBluUZ4NnZg","Golden Loves Guitar !!","8580293","Animals","82","2011-12-23T00:34:59.000Z","01/18/13","4.968378","5.0","1.0","86649","685","85964","mLvszOrcpkhGJLU9B5mYlA","Drew Arcoleo","https://gdata.youtube.com/feeds/api/users/drewarco22","Jammin' with my buddy's pup, enjoy! Follow Bailey on twitter: https://twitter.com/GoldLovesGuitar  Facebook: https://www.facebook.com/DrewArcoleoMusic  Twitter: https://twitter.com/Drew_Arcoleo"
"kfVsfOSbJY0","Friday - Rebecca Black - Official Music Video","46784595","Music","228","2011-09-17T01:38:01.000Z","01/18/13","1.7747864","5.0","1.0","1166577","940615","225962","GPI7zCpQYpPhDLdOAmpAww","rebecca","https://gdata.youtube.com/feeds/api/users/rebecca","This is the one and only official version of Rebecca Black's  Friday   music video."
"khCokQt--l4","Look At Me Now - Chris Brown ft. Lil Wayne, Busta Rhymes (Cover by @KarminMusic)","78949101","Music","216","2011-04-12T18:49:45.000Z","01/18/13","4.831015","5.0","1.0","564264","23838","540426","x26KtPU7eYKxyOblAxAkdQ","karmincovers","https://gdata.youtube.com/feeds/api/users/karmincovers","Vote Karmin's  Hello  to be on VH1's Top 20 Countdown: http://bitly.com/VoteHello  Download this song on iTunes: http://itunes.apple.com/us/album/look-at-me-now-live-original/id435608612  Musical inspiration from  A Milli  -  Lollipop  - and Lord of the Rings.  WEBSITE http://www.karminmusic.com ITUNES http://bit.ly/Karmin-iTunes TWITTER http://www.twitter.com/karminmusic FACEBOOK http://www.facebook.com/karminbook LIFESTYLE http://www.karminology.com"
"khg1Xh70x1o","Runaway Golf Cart Bowling at Cowboys Stadium","941246","Entertainment","89","2011-12-18T04:54:31.000Z","01/18/13","4.928571","5.0","1.0","1848","33","1815","8lmtRvDSaDI3rrod7a1s5w","Papa1472008","https://gdata.youtube.com/feeds/api/users/Papa1472008","Golf cart mows down everyone in sight after a high school football game in Cowboys Stadium on December 17, 2011"
"kHmvkRoEowc","LEAVE BRITNEY ALONE!","45411985","Entertainment","132","2007-09-10T22:03:22.000Z","01/18/13","2.5496655","5.0","1.0","411090","251827","159263","J3eOE-rgepshkPLE-v5vZg","itschriscrocker","https://gdata.youtube.com/feeds/api/users/itschriscrocker","Me @ the Zoo is an HBO Documentary Film about the phenomenon of internet celebrity, starring Chris Crocker. Watch it on HBO June 25 at 9PM.  BOOKING: nickpampenella@theagencygroup.com My Twitter: http://twitter.com/ChrisCrocker My MUSIC: http://itunes.com/ChrisCrocker Fan Facebook: http://facebook.com/ChrisCrockerOFFICIAL"
"kl1ujzRidmU","Facebook Parenting: For the troubled teen.","36787721","People","503","2012-02-08T18:16:55.000Z","01/18/13","4.634776","5.0","1.0","452851","41348","411503","6OSygSHWSo4pbV5ttl2YPg","Tommy Jordan","https://gdata.youtube.com/feeds/api/users/alornmage","Warning: Since this video seems to have gone crazy, I figure I'll post this notice. I'm going to read a letter my 15 year old daughter wrote. There ARE some curse words in it. None of them are incredibly bad, but they are definitely things a little kid shouldn't hear... not to mention things MY KID shouldn't say! If you want to see the original Facebook thread, it's located at: http://www.facebook.com/tommyjordaniii/posts/299559803434210 ----------------------------------------------------------------------------------------------  My daughter thought it would be funny/rebellious/cool to post on her Facebook wall just how upset she was and how unfair her life here is; how we work her too hard with chores, never pay her for chores, and just in general make her life difficult.  She chose to share this with the entire world on Facebook and block her parent's from seeing it. Well, umm... she failed. As of the end of this video, she won't have to worry anymore about posting inappropriate things on Facebook...  Maybe a few kids can take something away from this... If you're so disrespectful to your parents and yourself as to post this kind of thing on Facebook, you're deserving of some tough love. Today, my daughter is getting a dose of tough love.   © Copyright 2012, by Tommy Jordan. All rights reserved. Duplication without express permission of the author is prohibited."
"kQ_7GtE529M","Douchebag Bison","2189554","Animals","21","2011-11-06T08:26:33.000Z","01/18/13","4.859029","5.0","1.0","8938","315","8623","8YnMrxvUfKC753Z_vzPMcw","logtronic1424","https://gdata.youtube.com/feeds/api/users/logtronic1424","Bison don't give a FUCK"
"kVXi_0H_ZzM","ORIGINAL! Bellingham Carolina & Grant St Tree Fire Explosion 10.03.09","570714","People","288","2009-10-05T01:30:26.000Z","01/18/13","4.907653","5.0","1.0","2339","54","2285","0uwLNLieSj26cQVnJT2V3A","Jacquee816","https://gdata.youtube.com/feeds/api/users/Jacquee816","*WE CALLED THE FIRE DEPARTMENT FOR SAFETY AND THE ELECTRIC COMPANY BEFORE WE STARTED FILMING!!!!!*  My husband and I stopped to look at some pallets about a block from our house and my husband heard weird buzzing. The tree across the street was blowing into a high voltage power line and catching on fire. We called the Bellingham FIRE DEPARTMENT about 10 minutes before we started filming- many people called. (Puget Sound Energy was also called) They showed up about 5 minutes after we stopped filming. They missed the big show!    No one got hurt. The power was out for a few hours while the tree was cut down. The family that lived in the house next to the tree evacuated long before we started filming.  What an insane thing to see. Neighbours from 4+ blocks away were coming to see what was going on because they could FEEL and hear the first explosion. Nuts."
"kWBOWbAzfuM","Kunoichi Ninpocho - Vajayjay Magic! #2","1455924","Film","120","2010-09-11T05:53:58.000Z","01/18/13","4.834425","5.0","1.0","3817","158","3659","9Bu6lmLCOY-Z0KeDr48zuA","Sardonicus1313","https://gdata.youtube.com/feeds/api/users/Sardonicus1313","I find it odd that the only two acts from this ludicrous series I can get away with posting have a Don Ho-inspired theme...In this scene from the third installment of  Female Ninjas Magic Chronicles  (1993), hot little kunoichi Osaba and Richard Simmons' intern Sumino pause their dual in a last ditch attempt to ditch their V Cards...having astral projection sex?! Breaking it off before The Big O, Osaba demonstrates how she won a lawsuit against Massengill."
"KZ-slvv_ZT4","Opening Beer with Chainsaw","2916002","Education","39","2012-05-17T12:15:29.000Z","01/18/13","4.886623","5.0","1.0","13336","378","12958","9EUaxujdpShIuwTSSr0Nag","Reborious","https://gdata.youtube.com/feeds/api/users/Reborious","You can open a beer with a fork? That's nice...  Interview: http://www.youtube.com/watch?v=TtMwoRLNO5s&list=WL71602A7F43E27CC9&index=1&feature=plpp_video"
"l2TvNlEc9pw","WHITE BOY WASTED feat. Dumbfoundead - (Your Favorite Martian music video)","6072328","Music","245","2012-03-01T00:48:55.000Z","01/18/13","4.520386","5.0","1.0","64652","7752","56900","ESNYRD3HRimEVi-2EpziVg","Yourfavoritemartian","https://gdata.youtube.com/feeds/api/users/Yourfavoritemartian","Just a good ol' fashioned drinking song. ;)  DOWNLOAD THE MP3: http://itunes.apple.com/us/album/white-boy-wasted-single/id505490062  Check out more of Dumbfoundead: http://www.youtube.com/dumbfoundead  OUR FACEBOOK: http://www.facebook.com/urfavoritemartian"
"l99HRfB8AXA","Actual Zebra Attack","1135061","Animals","60","2011-06-14T04:32:15.000Z","01/18/13","4.600763","5.0","1.0","1573","157","1416","B9XanAxCvI4yXMK3a4yddA","Meagan Sweatman","https://gdata.youtube.com/feeds/api/users/MeaganVS","Zebra attack = the ugly cry :P"
"LbNl3J8HXw4","Pacman Frog catch some touch screen bugs.","10161581","Comedy","27","2011-12-21T07:58:29.000Z","01/18/13","4.944736","5.0","1.0","48422","669","47753","8FIhQ54RIuDiqQxls7XF7Q","rlawhdgjs3","https://gdata.youtube.com/feeds/api/users/rlawhdgjs3","[Original video on youtube.]"
"LCYPGnJdO1U","The Online Gamer - Game Night","9967945","Shows","209","2009-12-23T20:04:22.000Z","01/18/13","4.9030523","5.0","1.0","72864","1766","71098","G8zuw2qAEl7LSuzlBQFajg","RecklessTortuga","https://gdata.youtube.com/feeds/api/users/RecklessTortuga","What if an online gamer played monopoly like he played Modern Warfare?"
"LdlupO1bkHA","Woman Falls Onto Subway Tracks","725119","News","48","2009-11-10T13:10:18.000Z","01/18/13","4.0305777","5.0","1.0","883","214","669","lzCn8DxRSCuMFv_WfzkcrQ","CBS","https://gdata.youtube.com/feeds/api/users/CBS","An intoxicated 26-year-old woman stumbled and fell onto subway tracks in Boston. As Russ Mitchell reports, the train stopped half-way over her body."
"lF8w3zN0xiA","Crazy Free Throw by Idaho State's Kamil Gawrzydek","9869515","Sports","81","2010-12-22T06:32:15.000Z","01/18/13","4.8830805","5.0","1.0","5337","156","5181","r5Og7pViujUJRL7QO1ASSA","BigBlueChat","https://gdata.youtube.com/feeds/api/users/BigBlueChat","Kamil Gawrzydek's free throw sits balanced on the front of the rim at the 2010 Gossner's Invitational vs. Utah State University."
"LJ0sDES7Dpc","Turtle Says Wow","723787","Comedy","17","2010-08-03T18:50:21.000Z","01/18/13","4.896451","5.0","1.0","2395","62","2333","dn4EY9wLNc2tELxwHMb_jw","crazykb14","https://gdata.youtube.com/feeds/api/users/crazykb14","At the zoo with some turtles gettin it on ;). DO NOT COPY THIS VIDEO AND DO NOT COMMENT IF YOU'RE JUST GONNA HATE! ORIGINAL VIDEO!"
"lj3iNxZ8Dww","Miss Teen USA 2007 - South Carolina answers a question","56783781","Entertainment","48","2007-08-25T02:47:29.000Z","01/18/13","4.6735797","5.0","1.0","72569","5922","66647","XfarUtHQm0Nc0CCMmQiiwA","IRamzayI","https://gdata.youtube.com/feeds/api/users/IRamzayI","Miss Teen USA 2007 - Ms. South Carolina answers a question"
"llHKUzjggg4","Chicken Fiddler","610252","Comedy","96","2008-01-16T03:26:32.000Z","01/18/13","4.172672","5.0","1.0","4274","884","3390","6VuXCJ1e-m_WFUn8QcSLDQ","andyanders","https://gdata.youtube.com/feeds/api/users/andyanders","http://lisahaley.com/ For more fiddler fun go to lisahaley.com for a big fat taste of Cajun/Zydeco and Americana. And don't forget to check out our latest album, Joy Ride! on iTunes, CDBaby, amazon and more... The legendary Chicken Fiddler strikes again! This time she butchers  Dixie  and  Johny B Good.  Hear more Lisa Haley & the Zydekats, and her GRAMMY nominated album  King Cake,  at lisahaley.com."
"Lmy9R_WtPbg","Doc Bottoms Aspray AllOver  Body Deodorant Commercial w/ Adam Jay","1016111","Entertainment","122","2009-07-17T21:55:42.000Z","01/18/13","4.567398","5.0","1.0","1914","207","1707","QYFN-5ZteJg7S_-oA168yw","DocBottoms","https://gdata.youtube.com/feeds/api/users/DocBottoms","Doc bottoms Aspray the all over body deodorant that stops odors causing bacteria in their tracks! Use on  feet and pits even down below. 100% natural fragrance free..Pungent pits, foul feet, beastly butt odor....how do you stop the stink? Aspray is safe for all your odor zones!"
"LN-Tn0_Wj7w","Tigger Got Swag so funny","510614","Comedy","147","2011-06-11T01:28:41.000Z","01/18/13","4.9568744","5.0","1.0","13078","141","12937","T-bAocMKp3RM_27f7Bpq3A","mustafa omari","https://gdata.youtube.com/feeds/api/users/boobs00100","loool sub plz"
"lo2YPNhqLoA","Baby stuck behinde couch!","991670","People","147","2009-11-22T21:12:36.000Z","01/18/13","4.8847094","5.0","1.0","4094","118","3976","RpSTktLiY8iFtqxb5f6Pmw","Moe Asraei","https://gdata.youtube.com/feeds/api/users/mohammadasraei","He is smart and cute ;)"
"LQ0S0BUE0zg","Drunk Ewoks on Today Show","978314","Comedy","286","2009-10-30T22:25:44.000Z","01/18/13","4.9155226","5.0","1.0","3788","80","3708","Al_IkC5XN43xMIDKjMJ8Vg","doleph1","https://gdata.youtube.com/feeds/api/users/doleph1","Yes, this just happened (well this morning at least)..."
"LU_qVnISDXQ","WATCH!Kid Cudi is my FAVORITE! Little girl loves kid cudi","2197449","Music","72","2011-01-01T05:37:15.000Z","01/18/13","4.9302087","5.0","1.0","15532","271","15261","7kIsqRiQ7HooIkFfBWN8nw","GoodOleDaveyBoy","https://gdata.youtube.com/feeds/api/users/GoodOleDaveyBoy","My daughter Chevelle snaps out of her slumber to her favorite song...She's gonna be a STARRRRRR!!!!!!!!!  Kid Cudi Is My Favorite   Kid Cudi Is My Favorite   Kid Cudi Is My Favorite   Kid Cudi Is My Favorite   Kid Cudi Is My Favorite   Epic: Little Girl Loves Kid Cudi!  Epic: Little Girl Loves Kid Cudi!  Epic: Little Girl Loves Kid Cudi!  Epic: Little Girl Loves Kid Cudi!  Epic: Little Girl Loves Kid Cudi!   Little Girl Dances To Kid Cudi In Car! Little Girl Dances To Kid Cudi In Car! Little Girl Dances To Kid Cudi In Car! Little Girl Dances To Kid Cudi In Car! Little Girl Dances To Kid Cudi In Car!"
