"video_id","video_title","view_count","category","duration_in_seconds","upload_time","captured_time","avg_rate","max_rate","min_rate","num_raters","num_dislikes","num_likes","uploader_id","uploader_name","uploader_url","video_desp"
"AXmQ5JUCjVE","Tourettes Syndrome is Funny?","989651","Entertainment","860","2011-08-13T01:24:51.000Z","01/18/13","4.650082","5.0","1.0","12803","1120","11683","oMqf9iGuUkghiVHIRAOaLw","BreakingNYC","https://gdata.youtube.com/feeds/api/users/BreakingNYC","Sam's YouTube: http://bit.ly/oZ76IE  The song at :09 is  Grandma Got a Facebook  ‪‪http://bit.ly/mkzCcf‬‬  The song at :24 is Stay Offa My Facebook  http://bit.ly/aliW2S  The song at 1:22 is  Robot Bar Fight  http://bit.ly/o87MBo  The song at 6:49 is  Red  http://bit.ly/eHfMCb  The outro song is  Stay Offa My Facebook  ‪‪http://bit.ly/aliW2S‬‬  **All editorial images, graphics, and clipart used in this video are public domain images."
"ay5AOSxHqFU","Struttin' Remix","505678","Comedy","65","2010-06-23T11:33:56.000Z","01/18/13","4.9026546","5.0","1.0","10848","264","10584","vmGLbsnx3jKjuN9T8p3vqg","Tubbs004","https://gdata.youtube.com/feeds/api/users/Tubbs004","Version 2.0 of Struttin'  Huntsville reporter learns how struttin is important!  The background music is original ganstaz app for iPhone"
"beWo2Ic3cbQ","Cats after anesthesia","2329891","Animals","49","2012-06-04T09:46:19.000Z","01/18/13","4.4395323","5.0","1.0","21375","2995","18380","0ksT6pHLj_R2nudvsFcZBA","Mr7funny","https://gdata.youtube.com/feeds/api/users/Mr7funny","if you want to watch the best funny new video please vist and like our page on facebook http://www.facebook.com/7funny"
"bG8Y4BUKF3I","GET YOUR TITS OUT!!","510506","Comedy","65","2009-06-26T12:45:05.000Z","01/18/13","4.735772","5.0","1.0","1968","130","1838","nVEVGB1_76Mag4GqZk3TGQ","keiharddelekkerste","https://gdata.youtube.com/feeds/api/users/keiharddelekkerste","Follow me on twitter: http://www.twitter.com/j0na | Four guys in a car try to persuade four girls in a car to get their tits out! Open the window! Check out her tits! Go on get your tits out!!"
"bhuYIr1J1zc","Hey, Baby! (Original Upload) by Komikero","5051553","People","60","2009-01-28T14:50:33.000Z","01/18/13","4.9254823","5.0","1.0","38219","712","37507","gtqE_vy5WlrhVMD99mX91w","komikero","https://gdata.youtube.com/feeds/api/users/komikero","Shirts and stuff! http://www.cafepress.com/komikero My Official Facebook Page! http://www.facebook.com/GerryAlanguilanArt Where did I get the idea for the video? Click on the video below! THE SECRET BEHIND THE SMILE http://www.youtube.com/watch?v=7xuagd6H-Yg"
"bmTxB5nXlzk","cat opens freezer","2401534","Comedy","65","2012-02-29T21:03:13.000Z","01/18/13","4.918713","5.0","1.0","7086","144","6942","muxZ34EW7cjFEMW-xHd0Mw","alllettersnonumbers","https://gdata.youtube.com/feeds/api/users/alllettersnonumbers","This is why there's a safety lock on our freezer door. Oscar learned to do this on his own. A 2nd video is up as well, Oscar  opening closed doors too! Feel free to subscribe to the channel as I will continue to upload content frequently. Thanks for watching!"
"bNF_P281Uu4","Where the Hell is Matt? 2006","18197838","Travel","222","2006-06-20T23:28:10.000Z","01/18/13","4.8665957","5.0","1.0","95769","3194","92575","__TABIHzr7fUz5pQL2GU4w","mattharding2718","https://gdata.youtube.com/feeds/api/users/mattharding2718","I had a great time making this. Hope you enjoy it. www.wherethehellismatt.com www.STRIDEgum.com"
"BPnP_zlYU44","LIKE MAH STATUS.","9306591","Comedy","145","2011-08-21T23:19:47.000Z","01/18/13","4.8531036","5.0","1.0","121419","4459","116960","eNgRHpH7OHZetYjC5JZXGw","MilesJaiProductions","https://gdata.youtube.com/feeds/api/users/MilesJaiProductions","No. Nobody wants to like your status. ....And I know it's redundant, but we're selling shirts now. :|  LIKE MAH STATUS T-SHIRTS: http://www.etsy.com/shop/HMPHCreations?ref=ss_profile  For US: http://milesjaiproductions.spreadshirt.com/ For UK: http://milesjaiproductionuk.spreadshirt.co.uk/ For EU: http://milesjaiproductions.spreadshirt.net/  CONTACT INFO:  FACEBOOK: http://tinyurl.com/3qkav36  TWITTER: http://twitter.com/milesjai  TUMBLR: http://milesjai.tumblr.com  DAILYBOOTH: http://dailybooth.com/milesjai  OTHER YOUTUBE CHANNELS: http://www.youtube.com/MilesJaiVLOG http://www.youtube.com/MilesJaiProductions http://www.youtube.com/MilesJaiProductions2"
"bPNyK7XTy6o","FAMILY HOME DESTROYED BY AVALANCHE - CHILDREN TO BLAME","4190296","Comedy","199","2011-11-17T23:17:48.000Z","01/18/13","3.727301","5.0","1.0","19307","6143","13164","JJ3inpts6SOlqQp5HHHrsw","mtmuzic","https://gdata.youtube.com/feeds/api/users/mtmuzic","Mommy was not feeling well and had to stay in the bathroom longer than usual during which my two boys, ages 1 and 3 took my new bag of flour out of the cupboard and destroyed my house. This is from ONE 5lb bag.  Don't believe me? Hand a full bag to a   3 year old and see what happens.  In October, a very close friend of ours suffered a cerebral hemorrhage in the middle of his brain stem. Here is is caring bridge site with daily updates from his wife. Please pray for them and for the Lord to relieve their financial, emotional and physical suffering.  http://www.caringbridge.org/visit/danhoulahan"
"BQRMvg5TAl8","Devils & Angels - Family Feud","9182683","Entertainment","130","2011-02-02T00:08:43.000Z","01/18/13","4.9559417","5.0","1.0","42943","473","42470","t8jfvd9skBAOT6XJwc_mJg","FamilyFeud","https://gdata.youtube.com/feeds/api/users/FamilyFeud","Name something that gets passed around? (Show FF10-129)"
"BScrP-lW60E","Harry Baals","1056529","News","146","2011-02-10T05:25:43.000Z","01/18/13","4.9404325","5.0","1.0","3559","53","3506","OW3LG5_3_pZDCjEc3xHgrg","wane","https://gdata.youtube.com/feeds/api/users/wane","A former Fort Wayne mayor is getting some national attention. Thousands of people voted online to name the new city-county building in his honor.  But that probably won't happen because of his name."
"BujoOxjB3b4","What happens if you talk with your phone in a concert?","1638889","Comedy","41","2007-04-01T23:59:11.000Z","01/18/13","4.913347","5.0","1.0","6878","149","6729","DPafmtNGY2gQTjRwYEgS8A","cench","https://gdata.youtube.com/feeds/api/users/cench","The musicians were playing normally and suddenly..."
"bxDlC7YV5is","Greyson Chance Singing Paparazzi","49694381","Music","218","2010-04-29T00:15:34.000Z","01/18/13","4.8425875","5.0","1.0","327649","12894","314755","VLMS691o0TQZked8ESG9pw","greyson97","https://gdata.youtube.com/feeds/api/users/greyson97","Buy my debut album  Hold On 'Til The Night  at http://itunes.com/greysonchance. Me performing  Paparazzi  by Lady Gaga at Edmond's Sixth Grade Festival.   I own no rights to this song.  Follow me on Twitter at http://twitter.com/greysonchance"
"BymeLkZ7GqM","WHO KILLED CAPTAIN ALEX","1941709","Film","99","2010-01-30T11:39:18.000Z","01/18/13","4.8681316","5.0","1.0","11102","366","10736","YK-lJOeYdoKuDDdGscCFMA","NABWANATHE31","https://gdata.youtube.com/feeds/api/users/NABWANATHE31","A Wakaliwood and Ramon Film Production, Uganda  WHO KILLED CAPTAIN ALEX is Uganda's first action film and was filmed on location in Wakaliwood, Uganda.  Produced, Written, Shot, and Edited by Isaac Godfrey Geoffrey (I.G.G.) Nabwana."
"bysPw1-DBLE","Boy impressing girl FAIL","648480","Entertainment","6","2011-12-18T07:26:48.000Z","01/18/13","4.8377624","5.0","1.0","2145","87","2058","lfNnKmCfIfjgp6qT8iZoUw","Nathan Rees","https://gdata.youtube.com/feeds/api/users/VideoProfesh","Fail to impress girls!  http://facebook.com/nath.rees"
"BYW6C44zo24","Sittin On Tha Toilet","69717309","Music","43","2009-09-15T12:30:07.000Z","01/18/13","4.418382","5.0","1.0","305479","44418","261061","dNClun-Na9VEBvus1F_zaw","Alonzo Chadwick","https://gdata.youtube.com/feeds/api/users/alonzochadwick","I wanna make this Clear so please read this description below: This is not me it is my Friend & Sis (Nonnie). Nonnie posted a picture of me on Myspace 2 years ago. I told her I would get her back. She uses my flip camera all the time and used it to film all of her video's of her video's that are on her page (Which her user name & page is  eedabc123 ). She used my camera to make this video apparently, and she forgot to delete it from the camera. Thus led to the posting of this video (THE ULTIMATE REVENGE) Ahahahaha.  She does know I posted it if you read the very 1st comment it was from her. This was simple a prank and was not posted to try to become popular.  SHE  is a hillarious person. I not only thought this would be funny, I knew it would be even funnier if a few hundred others saw it. NEVER imagined this many ppl would EVER see it.   She has other videos on her page  eedabc123  These links below are the funniest ones (In my Opinion).   http://www.youtube.com/watch?v=Jb8nfmVz-fw  http://www.youtube.com/watch?v=KfS2S4yFdVw  http://www.youtube.com/watch?v=yjIikSLfOWA  http://www.youtube.com/watch?v=xNomTAl6qJI"
"bZP4Ugev82I","Worst Wedding DJ EVER! (ORIGINAL)","5140320","People","52","2010-05-10T17:25:00.000Z","01/18/13","4.82644","5.0","1.0","14289","620","13669","uRiF4XGm_YkOrVVOpP0ncw","worstdjever","https://gdata.youtube.com/feeds/api/users/worstdjever",""
"C3JPwxQkiug","這個阿鼠實在是XD　 a cute hamster with a  cute shock","1259178","Animals","3","2010-10-25T13:17:47.000Z","01/18/13","4.960861","5.0","1.0","5621","55","5566","DfrLl5gQd3GPNS1JxXCUOw","TheGrayman1984","https://gdata.youtube.com/feeds/api/users/TheGrayman1984","驚訝的囧鼠 cute hamster with a  cute shock"
"C7hTAp6KrGY","Nicki Minaj - Super Bass By Sophia Grace Brownlee","40369310","Music","151","2011-09-19T09:21:25.000Z","01/18/13","4.807999","5.0","1.0","224645","10783","213862","Bbl9TWafqQcPfsdG32t--A","SophiaGraceBrownlee","https://gdata.youtube.com/feeds/api/users/SophiaGraceBrownlee","Follow Sophia Grace on twitter https://twitter.com/PrincessSGB"
"cbBlYfTbA44","Epic Cat Fight (cat's horror)","3618472","Animals","206","2010-11-24T20:15:17.000Z","01/18/13","4.877534","5.0","1.0","26293","805","25488","kIAPBRr82MUFDiHHjw8JpQ","ignoramusky","https://gdata.youtube.com/feeds/api/users/ignoramusky","cameraman - Akael88 http://www.youtube.com/user/akael88 http://myhomevideos.blogspot.com/2010/11/blog-post.html - about this video  sound director - ignoramusky /watch?v=cIkc3eGPeRk - video about making of sound  - used: music by Alan Silvestri (Predator & Predator II) http://www.youtube.com/artist/Alan_Silvestri just a little ....cut & glue ;)     ----------------- http://www.youtube.com/watch?v=Nfb1xZFT8Mw - Thank u RayWilliamJohnson ;)  http://www.youtube.com/user/LifeInATent - thx...u know ;)"
"CBQuPs5n8Wo","tv3 news little boy airport","1798919","Comedy","12","2010-12-22T23:29:00.000Z","01/18/13","4.882079","5.0","1.0","3867","114","3753","7RJKJcKdy8QRGmy1bEY4EA","garreth boyne","https://gdata.youtube.com/feeds/api/users/gboynemufc","wow 1 million views!! big thanks to lil jamie nd tv3"
"cdPGXClOE5g","Penguin takes a risky path.mpg","1429736","Comedy","38","2010-12-27T18:21:07.000Z","01/18/13","4.984451","5.0","1.0","3087","12","3075","Fs9d30vqWh4od3Sc9JeUDA","SurfingHedgehog","https://gdata.youtube.com/feeds/api/users/SurfingHedgehog","A penguin walking to the sea encounters a somewhat unexpected 'rock'"
"CE0Q904gtMI","Golden Eagle Snatches Kid","41535936","Animals","60","2012-12-18T23:48:54.000Z","01/18/13","4.538688","5.0","1.0","92250","10639","81611","LVfJkPgwpppAuJgTNL9AMw","MrNuclearCat","https://gdata.youtube.com/feeds/api/users/MrNuclearCat","A golden eagle tries to snatch a baby in Montreal! What if he got away with it!? Un aigle royal attaque un jeune enfant sur le Mont-Royal!  UPDATE: This video is a hoax produced by Antoine Seigle, Félix Marquis-Poulin, Loïc Mireault and Normand Archambault, students at Centre NAD Details: http://bit.ly/VQ5rMw  MISE À JOUR: Cette vidéo est un canular réalisé par Antoine Seigle, Félix Marquis-Poulin, Loïc Mireault et Normand Archambault, étudiants au Centre NAD. Précisions: http://bit.ly/12AmJTy"
"CGir60wKNJM","7th-grader Stops School Bus After Driver Has Heart Attack  Raw Video  4-9-2012","1251790","News","52","2012-04-10T04:01:52.000Z","01/18/13","4.947119","5.0","1.0","6127","81","6046","p65falg0z5wHRmRdvuruyw","newsudontsee","https://gdata.youtube.com/feeds/api/users/newsudontsee","7th-grader stops school bus after driver has heart attack,Police say a student did a great job when he managed to stop a school bus after the driver had a heart attack Monday morning. Fife School District Assistant Superintendent Jeff Short said the bus was on its way to Surprise Lake Middle School when the substitute driver became incapacitated.   Seventh-grader Jeremy Wuitschick was on the bus and said the driver let go of the wheel and started flailing his arms.    I knew something was wrong,  he said.Wuitschick said he got up and grabbed the wheel, turned the bus toward the side of the road and turned off the ignition.    It was pretty scary,  Wuitschick said.  It was all happening really quickly.    The bus came to a stop outside of Discovery Pimary School, which is next to Surprise Lake Middle School. John McCrossin, director of student programs for the Fife School District, was driving behind the bus when he noticed the bus veer off to the side of the road.   He ran onto the bus after it stopped and found the driver unconscious and not breathing. The kids told McCrossin they already called 911, so he began performing CPR on the driver until police and medics arrived. The driver was taken to a hospital, but his current condition was not known.   Fife Police Chief Brad Blackburn said no one else was hurt thanks to the students who brought the bus to a safe stop."
"cL_qGMfbtAk","Annoying Orange - Annoying Orange Wazzup","47240641","Shows","73","2010-01-22T19:03:25.000Z","01/18/13","4.812862","5.0","1.0","127991","5988","122003","i-5OZ2tYuwMLIcEyOsbdRA","realannoyingorange","https://gdata.youtube.com/feeds/api/users/realannoyingorange","Annoying Orange hangs out with the whole gang. Spoof of the old Budweiser commercials.  FREE version of my video game Kitchen Carnage is out!!! iTunes: http://bit.ly/AOKitchenCarnageLite Android: http://bit.ly/KCLiteGoogle  MERCH: AO TOYS! http://bit.ly/AOToys T-SHIRTS: http://jcp.is/AOinJCP   iPHONE  iPOD GAME: http://bit.ly/KitchenCarnage iPAD GAME: http://bit.ly/KitchenCarnageHD ANDROID GAME: http://bit.ly/qqDmRi  FOLLOW ME: TWITTER: http://twitter.com/annoyingorange FACEBOOK: http://facebook.com/annoyingorange MY WEBSITE: http://annoyingorange.com  WATCH ALL MY EPISODES: http://bit.ly/AOPlaylist  CREATED BY:  DANEBOE: http://youtube.com/daneboe DANEBOE GAMING CHANNEL: http://youtube.com/superboebros DANEBOE 2ND CHANNEL: http://youtube.com/user/gagfilms"
"CLDSE7RHvno","Inception Cat","4893005","Animals","69","2010-09-02T16:49:18.000Z","01/18/13","4.864137","5.0","1.0","36949","1255","35694","ntJI47ctkRsc1l1m9xeFBg","spederson7","https://gdata.youtube.com/feeds/api/users/spederson7","Inception Cat will haunt your dreams  Music: Zack Hemsey - Mind Heist (Inception trailer)"
"CMNry4PE93Y","Zombie Kid Likes Turtles","39732826","Entertainment","17","2007-06-11T00:19:41.000Z","01/18/13","4.8889446","5.0","1.0","141479","3928","137551","PlpJXGoNKFYAGgqse4mQ2g","3mediapro","https://gdata.youtube.com/feeds/api/users/3mediapro","Zombie Kid Likes Turtles"
"cMsGOgDQrAs","Monkeys","1002383","Comedy","31","2009-05-22T12:14:28.000Z","01/18/13","4.899491","5.0","1.0","2945","74","2871","k9k_TvgJNFfTkvVDGwN73g","ndekeluka","https://gdata.youtube.com/feeds/api/users/ndekeluka","Monkeys on the hood"
"cPoDIhTRo1k","Hug E Gram / HugEGram Commercial - Complete fail","502204","Entertainment","61","2010-02-02T17:50:01.000Z","01/18/13","4.4993863","5.0","1.0","815","102","713","njpbi5wP9BGKNrBWD6JmYw","JFHProductions","https://gdata.youtube.com/feeds/api/users/JFHProductions","This is a fail worse than the snuggie. The fact that this seriously exists and is being advertised is very sad.  Fail. But I saw this on TV one day. Here's the site: http://www.hugegram.com/"
"cQhHHMmPKc4","DJ Greyboy's french bulldog DJ MAMA doggy scratch pt. 2 dog scratching","645059","Entertainment","39","2010-06-30T23:48:05.000Z","01/18/13","4.742219","5.0","1.0","2731","176","2555","1wGkKFbGrPLuc0w4LJr0Tw","djgreyboy","https://gdata.youtube.com/feeds/api/users/djgreyboy","DJ GREYBOY's french bulldog, MAMA, flexing her DJ skills at the mini mansion in long beach, ca.  http://www.mamathefrenchie.com/   http://greyboy.bandcamp.com/album/greyboy-era-correct  Check out DJ MAMAs facebook fan page: http://www.facebook.com/pages/DJ-MAMA-aka-Funk-Master-Frenchie/129370350439854?ref=sgm www.soundlock.com for more GREYBOY tunes!!  and follow us on twitter @djgreyboy and www.impaktsidehacks.com for more!!"
"CQzUsTFqtW0","Skateboarding Dog","20503578","Animals","88","2007-06-28T21:28:37.000Z","01/18/13","4.8895197","5.0","1.0","51086","1411","49675","vtfT-xYX4Q-jC2Mbsk3OUA","rnickeymouse","https://gdata.youtube.com/feeds/api/users/rnickeymouse","Tillman the skateboarding bulldog from the iphone commercial. All clips are from January 2007. Tillman was a little over a year old at the time.  A little history of this first video. I Filmed the video using a just purchased Panasonic Lumix TZ1. I was bicycling through Venice Beach California when I came upon the skateboarding dog. Originally the first video had the soundtrack  Giving In  by linkin Park. Once the video appeared in iphone commercials I  removed the video from youtube because of the attention it was getting and I had no rights to use the song. As time approached for Apple's release of the iphone with youtube, youtube contacted me and requested I reinstate the video without the soundtrack. Youtube wanted users to be able to view the skateboarding dog in the store and after purchasing their iphone. Unfortunately youtube gave me only a few hours to re-edited video before the iphone release.  The original background sound on most of the clips was ruined by hysterical laughter from a woman watching Tillman so I cut and pasted sound in from other parts of the video to cover the laughter. That's why some claim they hear the word eskimo over and over-lol. When the original video with the Linkin Park soundtrack was selected it had around 15,000 views."
"Cyrbyy1TRwg","3 BEERS  NO HANDS  37 SECONDS","2402744","People","67","2012-01-13T18:43:19.000Z","01/18/13","4.844602","5.0","1.0","8031","312","7719","h6BR634nBi9TEFK5tN7n4g","shoenice22","https://gdata.youtube.com/feeds/api/users/shoenice22","HAVE YOUR TSHIRT WORN IN WHEN I AM NUMBER ONE. BUY TODAY ! http://shoenice.spreadshirt.com/ http://shoenice.spreadshirt.com/ http://shoenice.spreadshirt.com/"
"cz-iyah2i78","Bus Pwns Girl","883033","Entertainment","15","2009-07-25T06:45:32.000Z","01/18/13","4.944009","5.0","1.0","5358","75","5283","frU-tXPx7VUvNPAqW5RabA","Spong1975","https://gdata.youtube.com/feeds/api/users/Spong1975","No really...LOL"
"d4afy5q2cSM","Amazing Acrobatic Dog - slackline","1036068","Animals","82","2012-02-06T01:46:20.000Z","01/18/13","4.981199","5.0","1.0","15531","73","15458","cYh4sBObTzXTRhMRZj_RNw","nicknozzy","https://gdata.youtube.com/feeds/api/users/nicknozzy","i love working with ozzy in nice quiet natural places, although i also enjoy using city landmarks. but mostly we work and train in places like this.  at one with nature, man dog and the earth. also away from distractions, i add them later..i am working here on trying to get oz to stretch a little higher from the rope, its very hard to do and i understand why he wants to stay as low as poss, but hey, with out the training, he wouldn't be any where near a piece of rope or chain for that matter, i hope you enjoy, and i love comments and subscribers....filmed by tommy and nick  Ozzy is 3-75 yr old boy he is welsh border collie kelpie mix, both his parents work on a farm in Angelsea wales uk, the lovely farmer gave him to me, and i am still in contact with him and his wife, about ozzys exploits..    he is a perfect family dog, every thing i could have ever asked for, plus he is my bestest mate and confident.. ------------------------ if you would like a closer look at that  tuperware lid  here is ozzy getting to know it  http://youtu.be/MSi-UJtnx74 ------------------------    so for any one who reads this description and is wondering what all the booty hole comments, and valve replies , and rwj army comments, are about...this video was featured on the top youtube subscribed and viewed channel  Ray William Johnson  on the whole of the Internet. WOW the video is called  dog has superpowers  here is a link so you can have a look, very funny, and i am truly privileged for ozzy and me to have been highlighted.... http://www.youtube.com/watch?v=f23bZrJFnNo&feature=share&list=PL6A40AB04892E2A1F"
"d5exATIaQiI","20 Car Pile up P.1 - EveryPlaylist.com","1159627","News","494","2010-12-31T03:52:49.000Z","01/18/13","4.9127727","5.0","1.0","5136","112","5024","ASEHE6Ule23hlRTnQFnDGQ","IanJTime","https://gdata.youtube.com/feeds/api/users/IanJTime","http://everyplaylist.com/category/pictures/  -----Sexy Pics, Videos, and BEATS  20 Car accident Pile up on South Carefree and Powers ... Snow storm hill slip and slide Colorado Springs"
"d5mK7dzyUkM","Sariah Gallego Joins the Dark Side (Star Wars)","4660730","Comedy","35","2011-02-24T07:33:46.000Z","01/18/13","4.979291","5.0","1.0","38824","201","38623","P7BxAOsEmQDzfsKw315new","erndog714","https://gdata.youtube.com/feeds/api/users/erndog714","The Gallego family takes a trip to Disneyland and Sariah and Alex are chosen to join Jedi Academy!!!! Sariah decides to bow to Darth Vader and joins the Dark Side in front of everyone!!!!!"
"d7n8GqewJ2M","TIK TOK KESHA Parody: Glitter Puke - Key of Awe$ome #13","106966776","Shows","162","2010-02-02T17:55:49.000Z","01/18/13","4.7999754","5.0","1.0","301663","15085","286578","EmCXnbNYz-MOtXi3lZ7W1Q","barelypolitical","https://gdata.youtube.com/feeds/api/users/barelypolitical","Tik Tok Kesha Music Video Parody!  It's an Intervention!  Watch Behind the Scenes HERE! http://www.youtube.com/watch?v=8wxZctkd4DU  Subscribe! http://www.youtube.com/subscription_center?add_user=barelypolitical  Directed by Tom Small LYRICS by Mark Douglas  LYRICS Wake up in the morning looking greener than Shrek  Sleeping in a tub can really mess up your neck Before I leave I stop and vomit up tequilla and glitter Im spending every morning with my head in the s**tter Got vomit in my hair But Im way too sick to care Now Im fallin down the stairs I pull myself off the floor Then Im almost at the door But my family is waiting for me Oh crap not again Its an intervention Its cool Im fine I can stop at any time   DAD Thats a lie You wont try Now youve made your mother cry  Look!   MOM O o o o O o o o   KESHA Im outta here This is queer I just drank a couple beers   MOM Dont leave We love you We even hired Dr. Drew   DR. DREW This pattern needs to end   KESHA I think I have to puke again O o o o O o o o   KESHA So, I decide to stay, but my head is still reeling Then they all go down the line talkin bout their feelings   BROTHER [reading] It makes me sad when I see brush your teeth with Jack Also you borrowed my gold bike and never gave it back   DAD Stop showing off your butt Youre making young girls act like sluts And youre starting to get a beer gut   DR. DREW This behavior is a dead end P. Diddy is not your friend Youll end up like Lindsay Lohan  L-L-L-L-Lohan  KESHA  This is whack I feel trapped   DR. DREW We just want the old Kesha back   KESHA Screw you Dr. Drew And your stupid camera crew   MOM Hey you dont have to shout We're just trying to help you out  O o o o  O o o o  KESHA Okay Its time you know This is just a video I dont drink Or pee in sinks Thats just what I want my fans to think Its all an act And in fact Its even in my contract   FAMILY O O O O O O  MORE BARELY:  Subscribe! http://www.youtube.com/subscription_center?add_user=barelypolitical  Facebook! http://www.facebook.com/thekeyofawesome  Get the songs on iTunes! http://itunes.apple.com/us/album/the-key-awesome-deluxe-edition/id374349910  TShirts! http://thekeyofawesome.spreadshirt.com  Mark's Channel: http://youtube.com/markdouglas  Todd's Stuff http://youtube.com/wombatron http://www.twitter.com/toddwomack  Follow us on Twitter http://www.twitter.com/barelypolitical http://www.twitter.com/barelydigital  Write us a letter! The Key of Awesome P.O. Box 23 New York, NY 10113"
