"video_id","video_title","view_count","category","duration_in_seconds","upload_time","captured_time","avg_rate","max_rate","min_rate","num_raters","num_dislikes","num_likes","uploader_id","uploader_name","uploader_url","video_desp"
"-_49VS4nuao","Elmo and Cookie Monster have some Adult Fun","1313791","Comedy","42","2008-12-28T21:57:55.000Z","01/18/13","4.921736","5.0","1.0","9864","193","9671","ZcSyg9WKALBO4r97-pjmAg","Dan Wilson","https://gdata.youtube.com/feeds/api/users/danielbwilson","Discovered completely by accident by putting the toys away, it just had to be recorded and shared. Alone these toys seem innocent, but together, it is just wrong. Elmo Live and Tickle Me Extreme Cookie Monster."
"-goXKtd6cPo","First Blog / Dorkiness Prevails","4484903","Film","95","2006-06-16T18:49:21.000Z","01/18/13","3.25586","5.0","1.0","10068","4390","5678","VEfyEuLJpgw_y4jSgV8Rtg","lonelygirl15","https://gdata.youtube.com/feeds/api/users/lonelygirl15","So, I finally got a webcam and got it working (ugh, harder than I thought...). Hope you like it :)"
"-HePTmrV-og","We Love You Maria Venus Raj 22 Philippines","3556190","Entertainment","253","2010-08-24T08:27:12.000Z","01/18/13","4.797153","5.0","1.0","16860","855","16005","u1TBcXNK29GvIwud6rVJQw","lexlib","https://gdata.youtube.com/feeds/api/users/lexlib","We are only among many who went wild. Irina, Marelisa, Angela and Venus (you know who you are). We went crazy as Venus was named one of the semi-finalists. Watch especially from 2:17 onwards. Enjoy!  Congrats Venus, Mabuhay Ka!  We love you!  FYI on the four of us.   Veejay Floresca is one of the country's up and coming fahion designers and was a finalist during the first season of Project Runway Philippines. Twitter: http://twitter.com/veejayfloresca  Martin Bautista is also another young fashion designer who counts Charlene Gonzales as one of his clients. Twitter: http://twitter.com/MartinBautista9  Lex Librea works as a corporate travel consultant and is and avid sports fan.   Aleq Africa works in a leading real-estate firm. Twitter: http://twitter.com/fordbeautyqueen"
"-kIJqXLMLwc","shiba inu white pupy 【超可愛い】【初公開】白柴くもくんの鳴き声","5914475","Animals","49","2009-09-19T05:53:24.000Z","01/18/13","4.9594946","5.0","1.0","39007","395","38612","RL7_KwtbtYqACtAaWXA6Tw","okanouefamily","https://gdata.youtube.com/feeds/api/users/okanouefamily","生まれて9日目のくもくんです。 Thank you for watching this movie. I am glad that many people watched this movie. I have already handed over these puppies to my blog friend. But, I leave a growth record of detailed puppies in HP. http://blogs.yahoo.co.jp/sandonomeshi/folder/1197823.html?m=lc&p=7 It is Japanese blog, but can have you watch a photograph. When you come to my homepage, I am glad. Thank you."
"-UaW6zYQDQE","Mariko Takahashi's Fitness Video","590989","Howto","210","2006-03-16T05:43:31.000Z","01/18/13","4.5526156","5.0","1.0","1663","186","1477","ajte6UFGsKtxCvNabt26RQ","vinylboy20","https://gdata.youtube.com/feeds/api/users/vinylboy20","This is a mesmerizing and frightening video. It's a word-for-word parody of Susan Powter's first workout video, featuring poodles and a crazy poodle-woman. Absolutely surreal. It was made by Nagi Noda for Panasonic. It was part of 10 films they made for the 2004 Athens Olympics."
"-X21S0estDI","www.internet-media.pl - TWOJA STRONA WWW","737883","Nonprofit","105","2010-11-20T10:28:45.000Z","01/18/13","4.920816","5.0","1.0","1667","33","1634","qxTTwErxbT217MIAU3PKqQ","internetmediapolska","https://gdata.youtube.com/feeds/api/users/internetmediapolska",""
"__dUlY0JpSc","I feel dizzy!","4316512","Comedy","101","2012-05-25T23:12:12.000Z","01/18/13","4.88167","5.0","1.0","36339","1075","35264","YuBEoD3TanJAiBSzEuRyww","TheDizzays8","https://gdata.youtube.com/feeds/api/users/TheDizzays8","Waking up after anesthesia ORIGINAL VERSION http://www.ifeeldizzay.com"
"_BMT6BfxR7w","Cute Little Kids Arguing","1725068","Comedy","63","2010-05-13T04:27:44.000Z","01/18/13","4.927407","5.0","1.0","10304","187","10117","i7RPLpDF_W2zV_nHLbKo4g","omar jarwan","https://gdata.youtube.com/feeds/api/users/jarwan12","that tells me everything I need to know about who's going to RULE in the next generations :)"
"_JmA2ClUvUY","Talking Twin Babies - PART 2 - OFFICIAL VIDEO","77430734","Comedy","128","2011-02-14T16:19:21.000Z","01/18/13","4.8724356","5.0","1.0","215264","6865","208399","NMfDuRS4FBhHnefb4qgRMw","jayrandall22011","https://gdata.youtube.com/feeds/api/users/jayrandall22011","twin baby boys have a conversation part 2.  find more of the boys' adventures at my wife's blog.  visit http://www.twinmamarama.com/"
"_OBlgSz8sSM","Charlie bit my finger - again !","508093166","Comedy","56","2007-05-22T20:29:24.000Z","01/18/13","4.4946046","5.0","1.0","1142551","144360","998191","fHZCZHykS3IQDPyFfnqjWg","HDCYT","https://gdata.youtube.com/feeds/api/users/HDCYT","T-Shirts http://charliebitme.firebrandstore.com/ iPhone  http://itunes.apple.com/gb/app/charlie-bit-me!!!/id494858348?mt=8 Android  https://play.google.com/store/apps/details?id=com.viralspiral.charlie  Even had I thought of trying to get my boys to do this I probably couldn't have. Neither were coerced into any of this and neither were hurt (for very long anyway).  This was just one of those moments when I had the video camera out because the boys were being fun and they provided something really very funny.  FAQ Harry is 8 3/4, Charlie is 6 1/2, Jasper is  4 1/4, Rupert is 1 1/2 (November 2012)  Harry and Charlie Blogging - Charlie Bit My Finger Again! http://harryandcharlie.blogspot.com/  Twitter http://twitter.com/harryandcharlie"
"_SsUTLAhbWE","2 girls 1 cup Grandma reaction! Grandma Marlene.","9213134","People","92","2007-11-27T17:00:05.000Z","01/18/13","4.9243045","5.0","1.0","52896","1001","51895","PtRdlck9TdU3D2b4-AJZqA","Jacqueline7oX","https://gdata.youtube.com/feeds/api/users/Jacqueline7oX","Grandmas channel: http://www.youtube.com/GrandmaMarlene    https://twitter.com/JacquelineLeigh   NEW VIDEOS OF MY GRANDMA, GO CHECK OUT MY CHANNEL.    --------------------------------------------------------------- Answers to frequently asked question and stuff of that nature.  ======= 1. I do NOT know where to find the actually 2 girls 1 cup video. 2. I am a girl. 3. That is my friend that is laughing in the background. 4. My grandmother said  Jackie , not  darkie .. if you think she said that, you are an idiot. 5. No, my grandmother is not still mad at me, she never was mad. 6. Her name is Marlene. 7. That is a FERRET in the cage behind her. 8. She is in my room. 9. YES, she is really watching 2 girls 1 cup. 10. I do not read all comments. If you have a question, message me. 11. Yes, my grandmother was on the tv show  rudetube . 12. More videos of my grandmother will be up soon. ======= ---------------------------------------------------------------                                  If you like this video, please rate it thumbs up. :)      VOTE FOR MY GRANDMOTHER! http://www.gigglesugar.com/876600  ╔═╦╗╔╦╗╔═╦═╦╦╦╦╗╔═╗ ║╚╣║║║╚╣╚╣╔╣╔╣║╚╣═╣ ╠╗║╚╝║║╠╗║╚╣║║║║║═╣ ╚═╩══╩═╩═╩═╩╝╚╩═╩═╝     SEND ME YOU'RE REACTION TO YOU OR YOUR FRIENDS WATCHING THIS VIDEO!  Enjoy! and don't forget to SUBSCRIBE!"
"_tmMZv62BX4","FC Baar - FC Sempach: Joonas Jokinen (35) shoots penalty","7563056","Sports","18","2011-04-06T22:31:43.000Z","01/18/13","4.8979063","5.0","1.0","17004","434","16570","mx2wwwB4y0aJMdcHQOjX-Q","ollisjokinen","https://gdata.youtube.com/feeds/api/users/ollisjokinen","7.4.2011 Baar, Switzerland"
"_TP-ZzKbXJk","Japanese toilet experience 1","1422960","Travel","65","2007-09-16T22:30:35.000Z","01/18/13","4.76511","5.0","1.0","2912","171","2741","8ltLxwlmID7KtyhDwePB3A","veronicuspicus","https://gdata.youtube.com/feeds/api/users/veronicuspicus","Around Tokyo in the Shinjuku area I came across this bar with the weirdest toilet I've ever seen. A giant sumo wrestler's head was the least expected thing, let alone when it started singing and moving towards me ... the guys told me about the male toilet (urinary in the shape of giant lips that moved side to side) but unfortunately didn't record it!"
"_UIp36WuAxY","BREAKING BALLS!","1430085","Entertainment","577","2011-06-03T23:10:28.000Z","01/18/13","4.7617927","5.0","1.0","12762","760","12002","oMqf9iGuUkghiVHIRAOaLw","BreakingNYC","https://gdata.youtube.com/feeds/api/users/BreakingNYC","**NEW VLOG EVERY FRIDAY NIGHT!**  The song at 1:16 is  Tig Ol' Bitties  (not yet released)  The song at 2:24 is  Stay Offa My Facebook  http://bit.ly/kNA3Wm  The song at 2:57 is  Club Villain  is http://bit.ly/icbVIh  The song at 4:43 is  Grandma Got a Facebook  http://bit.ly/mkzCcf  The song at 7:07 is  Fight to Win  (not yet released)  The outro song is  Stay Offa My Facebook  http://bit.ly/kNA3Wm  KassemG's Youtube Channel: http://www.youtube.com/KassemG  Destorm's Youtube Channel: http://www.youtube.com/Destorm  Big Rob's Twitter: http://twitter.com/xxxBIGGGROBxxx  **All editorial images, graphics, and clipart used in this video are public domain images.  yt:quality=high raywilliamjohnson ray william johnson meekakitty destorm kassemg epic tig ol bitties fight to win rwj rjw first yourfavorite martian breakingnyc video breaking los angeles PIMP HAND STRONG vlog blog"
"_VtTzI69hvw","MaN  fALLS oFF tREaDMiLL","820890","Comedy","58","2009-10-03T05:53:26.000Z","01/18/13","4.866959","5.0","1.0","2736","91","2645","xNKPcCuxv06fGMZEPULXVg","jacolbybaca444","https://gdata.youtube.com/feeds/api/users/jacolbybaca444","man falls off of treadmill an plays it off"
"0_eR0PmDXfs","Haboob dust storm attacks Arizona wedding","1009912","Comedy","143","2011-10-11T03:30:54.000Z","01/18/13","4.8452787","5.0","1.0","879","34","845","LHRlEcqX7ctnHcUwbYkVcw","CaptureTheMemoryAZ","https://gdata.youtube.com/feeds/api/users/CaptureTheMemoryAZ","This Arizona wedding ceremony was interrupted by a huge dust storm (Haboob). Check out their reaction when they notice it coming!  www.WeddingVideoArizona.com © Capture the Memory Wedding Films 2011"
"0Au_8GMUxVs","Wasted guy at Coachella 2010 - FRIDAY","6477020","Comedy","99","2010-04-20T01:05:07.000Z","01/18/13","4.9004297","5.0","1.0","18158","452","17706","fZNkbUWo-9R6O_uQDjNQ4Q","stankshag","https://gdata.youtube.com/feeds/api/users/stankshag","I'm a casting director. I find people. http://www.facebook.com/pages/Epic-Junction/162716790456980  Some guy can't get his flip flops on bc he's so wasted in the afternoon... trying to get to the port-o-potties. PWAH!"
"0bomkgXeDkE","80s Video Dating Montage","2707770","Comedy","263","2009-09-18T13:59:08.000Z","01/18/13","4.9550514","5.0","1.0","18955","213","18742","B-RlScj5B7mpWFfHjifHpw","Jameson Murphy","https://gdata.youtube.com/feeds/api/users/jamesongmurphy","Before eHarmony"
"0DtwkTS9mq8","hand shake","2227794","News","39","2010-03-24T00:06:35.000Z","01/18/13","3.8781302","5.0","1.0","2396","672","1724","VjisTHS1hThLfwrv8W5Axw","cryguy29","https://gdata.youtube.com/feeds/api/users/cryguy29",""
"0HDqjX7gRyA","Bird Bullies Cat EPIC FAIL!!! w/YouTube Editor","1872964","Animals","79","2011-03-31T00:09:47.000Z","01/18/13","4.8048677","5.0","1.0","9573","467","9106","hQ6ow6MVoIYUwKvFg2HRWg","afolts8024","https://gdata.youtube.com/feeds/api/users/afolts8024","I saw the bird picking on the cat this morning. So I turned on the camera....  Question for you: Was this bird cruelty or did the bird get what he deserved? You decide.... Please leave a comment & rate by clicking thumbs up or thumbs down.   I created this video at http://www.youtube.com/editor  The background music I used is called  Ragtime Raggles Part 1  by Helen Jane Long according to the info on the YouTube Editor.  =3 RWJ Rules"
"0qAuqq1LFnU","Bank of America sings U2's One","700385","Entertainment","302","2006-11-09T04:34:46.000Z","01/18/13","3.0091324","5.0","1.0","1095","545","550","ZNCnJo3wEAlwDd3bztcZlw","thelookmachine","https://gdata.youtube.com/feeds/api/users/thelookmachine","So proud of itself for successfully merging with MBNA, Bank of America takes one of the most beautiful U2 songs and changes the lyrics so it's about . . . credit cards. And it's maybe meant to be a joke. But the singer takes himself so seriously, that it's not a joke."
"0QwrQFhh08o","Unluckiest Couple At Baseball Game","948354","Sports","18","2012-05-08T04:55:27.000Z","01/18/13","4.9252706","5.0","1.0","2034","38","1996","8l1MFlpo6zBxEgsNJRuAXQ","goalshighlights2012","https://gdata.youtube.com/feeds/api/users/goalshighlights2012","wont be getting married any time soon lol   Drunk Irish girl ranting 'her father works for KPMG'  Barcelona and Argentina forward Lionel Messi has been awarded the Ballon d'Or for a fourth year running. Messi, 25, hit 91 goals during 2012 and beat club team-mate Andres Iniesta and Real Madrid's Ronaldo to the trophy. Despite his goals, the Catalan giants failed to win either the Spanish league title or Champions League last year. Abby Wambach won the women's award and Vicente del Bosque the coach accolade, while the team of the year was made up only of players from Spain's La Liga.  Messi was announced as the winner of the Ballon d'Or, the award given to the world's best player, during a ceremony held in Zurich on Monday. He was part of a three-man shortlist for the prize, which is voted for by journalists, and national coaches and captains, alongside midfielder Iniesta and forward Ronaldo. He becomes the first player to win four consecutive Ballons d'Or, breaking the record he jointly held with former France international, and current Uefa president, Michel Platini.  To tell you the truth this is really quite unbelievable,  said the Argentine.  The fourth award that I have had is just too great for words.  I would like to recognise my other colleagues from Barcelona. Andres, it has been great to train and play alongside you.  I would also like to recognise all of my friends in the Argentina national team, everyone that has worked with me, coaches and staff and my family and my friends. Also my wife and my son. Thank you.  Messi - who polled 41.6% of the votes, with Ronaldo taking 23.68% and Iniesta 10.91% - was favourite to win after surpassing Germany striker Gerd Mueller's record of 85 goals in a calendar year from 1972. He netted 79 goals for Barcelona, plus another 12 for Argentina, in 69 games for club and country.  But Real Madrid clinched the Primera Division with a nine-point winning margin over their arch rivals, who were eliminated in the Champions League semi-finals by eventual winners Chelsea. Messi also featured in the team of the year, which was made up of 10 players from Barca and Real Madrid plus Atletico Madrid striker Radamel Falcao. USA forward Wambach was named women's world player of the year, the first American to win the award since Mia Hamm in 2002. Del Bosque and Pia Sundhage collected the men's and women's coaching gongs for their work with Spain and USA respectively. Real boss Jose Mourinho and Pep Guardiola, who left Barca in May to take a year's sabbatical from the game, finished behind Del Bosque. At a news conference before the Ballon d'Or ceremony, Guardiola confirmed he plans to return to management next season The Spaniard, 41, stepped down after winning 14 trophies in four years, including two Champions League crowns and three La Liga titles.  I will return [next season] because I am young, but I have been living the kind of life that I wanted and one that my family also deserved,  said Guardiola, who has relocated to New York with his wife and children. The Puskas Award for goal of the year went to Fenerbahce's Slovakian striker Miroslav Stoch for his strike against Genclerbirligi in March. Franz Beckenbauer received the Fifa Presidential Award and Uzbekistan won the fair play accolade for their disciplinary record."
"0rbMHLDY1pA","5 year old needs a job before getting married - funny!","11017464","Comedy","46","2011-02-22T12:17:23.000Z","01/18/13","4.6988387","5.0","1.0","49940","3760","46180","JAiUz39o40bJeV9-BNmZ7g","AnnaGraceMusic","https://gdata.youtube.com/feeds/api/users/AnnaGraceMusic","my Album just Launched!!. iTunes link. http://itunes.apple.com/us/album/anna-graceman/id550799223  part 1 of I need a job"
"0sRXkKe9SJk","Fat indian kid dancing. The newest internet sensation? - TMF","959966","Comedy","235","2011-09-14T05:09:27.000Z","01/18/13","4.6889825","5.0","1.0","3331","259","3072","KDXkgea4fSRFjNtFcMyKBw","Monster Fail","https://gdata.youtube.com/feeds/api/users/TheMonsterfail","http://www.monsterfail.com - more fail and funny videos  https://www.facebook.com/MonsterFail - Facebook Fan Page  Is this kid the next internet sensation?  yes or no?"
"0UIdI8khMkw","Driscoll Middle School Trick Play","18823165","People","27","2010-11-07T14:04:37.000Z","01/18/13","4.898678","5.0","1.0","65731","1665","64066","e1dAWgwSxEXsetZ16Stz0A","MillerBucVision","https://gdata.youtube.com/feeds/api/users/MillerBucVision",""
"0VuIShM5kAQ","How to kiss a woman by Captain Kirk","3323206","Howto","20","2009-08-15T01:51:08.000Z","01/18/13","4.8836765","5.0","1.0","6843","199","6644","layGLsr5DC7snEN0UG_D6A","bradsucks","https://gdata.youtube.com/feeds/api/users/bradsucks",""
"0y59IJAVUqA","The Greatest Zip Line Nut Shot Ever","625603","Entertainment","87","2009-03-13T01:43:44.000Z","01/18/13","4.66879","5.0","1.0","471","39","432","4lUZCJeYXcuq5sq8_x97xw","ihredemption","https://gdata.youtube.com/feeds/api/users/ihredemption","Follow us on twitter - https://twitter.com/thebigredfro Like us on facebook - http://www.facebook.com/Redonkulousness Zip Line Nut Shot"
"1P0yfq2wDvU","Greg Jennings (Broken Leg) scores on the saints","9345219","Comedy","68","2010-04-19T04:05:54.000Z","01/18/13","4.9249835","5.0","1.0","39778","746","39032","dK5Aimlil9hlCmXlgK1wCw","Demetry James","https://gdata.youtube.com/feeds/api/users/demetryjames86","Greg Jennings caught a pass from Aaron Rodgers and even though his leg was broke he was able to outrun the entire saints defense I was playing a joke name GUMBYBOUTDATLIF final score 49-20 Aaron Rodgers 24-28 395 Yards 5TD's 0Ints 158.3Passer Rating PLEASE DOWNLOAD The  F**k U Gumby Ringtone off itunes "
"1QqUFopqVnU","Eh Marine Original :D","8137361","Entertainment","6","2007-04-02T23:10:14.000Z","01/18/13","4.8358393","5.0","1.0","27266","1119","26147","SD5ygn7wUhfruo6nnJzAow","Calibos99","https://gdata.youtube.com/feeds/api/users/Calibos99","Deine besten 6 Sekunden des Tages ^^ Become a Fan @ Facebook! : http://www.facebook.com/pages/Eh-Marine-Official/333548903332771"
"1SqBdS0XkV4","Mary Cummins, Animal Advocates, Baby bunny eats a tiny flower, washes its face","1914006","Animals","108","2010-02-27T05:14:08.000Z","01/18/13","4.936334","5.0","1.0","14262","227","14035","vhKiKDfTWXz7Pqkm43Y7Xg","MaryCummins","https://gdata.youtube.com/feeds/api/users/MaryCummins","Mary Cummins, Animal Advocates, Baby wild bunny eats a flower then washes its face. The baby ate a few flowers and the stems. It's also eating hay, cilantro, spinach, parsley, grass and hay. It will be released back to the wild when it's able. Sorry about the sound. I'm on macro video mode inside a tupperware container. I think it's feedback.   If you think this wild baby bunny is cute, you should check out pet bunnies. They are even cuter, come in pretty colors and are super tame. This wild bunny is now so wild that I can't touch it any more.   Baby bunny was released back to the wild by MaryEllen. Thank you! http://www.youtube.com/watch?v=stPhpECp664 Mary Cummins, Animal Advocates, wildlife rehabilitation, http://www.animaladvocates.us http://www.mary-cummins.org http://www.marycummins.com"
"1x5tjPWwABc","Baby Sloths Get Potty Trained | Too Cute","583896","Entertainment","148","2011-12-21T20:45:21.000Z","01/18/13","4.919864","5.0","1.0","2945","59","2886","kEBDbzLyH-LbB2FgMoSMaQ","AnimalPlanetTV","https://gdata.youtube.com/feeds/api/users/AnimalPlanetTV","You wouldn't think that potty training baby sloths would be cute, but it is!  Too Cute's MOST ADORABLE CLIPS! http://animal.discovery.com/videos/too-cute-kittens-highlights/#mkcpgn=ytapl1"
"23Te7QAsH6w","Yelling At Cats","2556641","Comedy","146","2006-03-13T03:56:30.000Z","01/18/13","4.43861","5.0","1.0","25615","3595","22020","6vUFEx3Iy0PRQDmHTWXylQ","Biohazard64","https://gdata.youtube.com/feeds/api/users/Biohazard64","This Crazy guy yelling at cats I WILL END YOU! Thanks For Watching!"
"2fgBVbJkxRM","MOST RACIST VLOG EVER!","1028480","Entertainment","1024","2011-08-20T01:14:47.000Z","01/18/13","4.4676538","5.0","1.0","20528","2732","17796","oMqf9iGuUkghiVHIRAOaLw","BreakingNYC","https://gdata.youtube.com/feeds/api/users/BreakingNYC","**NEW VLOG EVERY FRIDAY NIGHT!**  The song at :23 is  Orphan Tears  http://bit.ly/fm1FO0  The song at 3:02 is  Orphan Tears  http://bit.ly/fm1FO0  The song at 5:11 is  Robot Bar Fight  http://bit.ly/o87MBo  The song at 5:40 is  Stay Offa My Facebook http://bit.ly/aliW2S  The song at 10:45 is  8-Bit World  http://bit.ly/oL5I5N  The song at 11:19 is  8-Bit World  http://bit.ly/oL5I5N  The outro song is  Stay Offa My Facebook  http://bit.ly/aliW2S  Gabriel's YouTube: http://www.youtube.com/hotandfluffycomedy  Big Rob's Twitter: ‪http://twitter.com/xxxBIGGGROBxxx‬  Lance's Twitter: http://twitter.com/lancepatrick  **All editorial images, graphics, and clipart used in this video are public domain images***"
"2hngBzDDyFE","Amazing Cat Gives Thumbs Up","3003892","Animals","38","2011-02-23T12:12:18.000Z","01/18/13","4.88181","5.0","1.0","14959","442","14517","wGKpMeAH8pjuABMBRv0_RA","tfg69","https://gdata.youtube.com/feeds/api/users/tfg69","Jimmy is a polydactyl cat. He's probably the laziest cat in the world but he's also super clever and has thumbs. And he's got a great party trick :-)"
"2mNB_VG_shc","Kitten Wearing a Tiny Hat - Audition Outtakes","4833857","Animals","9","2010-06-12T06:35:45.000Z","01/18/13","4.6798615","5.0","1.0","19629","1571","18058","KCJPvbOh01BCJfs7KMFukw","thetorkfool","https://gdata.youtube.com/feeds/api/users/thetorkfool","OMG!  Is Scout Jr. OK?!?  What is Speedo's PROBLEM!?!  Why does that WOMAN have such hairy ARMS?!??  Did anyone DIE!!??  I can answer all these questions and more!  Simply watch the other videos on my channel. http://www.youtube.com/user/thetorkfool .   Find out whether that HORRIBLE CAT is SCOUT JR.'S MOM or WHAT!  For all you know SCOUT JR. COULD BE SOME KIND OF ORPHAN!  QUICK!  SAVE SCOUT JR.!!   Watch and ALL your questions will be answered, and in any case it'll be better than the finale of Lost."
