"video_id","video_title","view_count","category","duration_in_seconds","upload_time","captured_time","avg_rate","max_rate","min_rate","num_raters","num_dislikes","num_likes","uploader_id","uploader_name","uploader_url","video_desp"
"plPsnWFng0w","Krispy Kreme - The Baddest","11025898","Music","227","2012-04-21T02:38:06.000Z","01/18/13","4.4053745","5.0","1.0","118932","17680","101252","77bLHly_nVZJzL-nXSO2XQ","FroggyFreshRap","https://gdata.youtube.com/feeds/api/users/FroggyFreshRap","Free MP3 Download: https://www.box.com/s/e25668553e4c47062a37 iTunes MP3 Download: http://tinyurl.com/9jj45p4 T-Shirt: http://tinyurl.com/d7cr2pf Autographed Album: http://tinyurl.com/d7cr2pf Here is my face book: http://www.facebook.com/KrispyKremeRap Here is my twitter: https://twitter.com/#!/KrispyKreme4eva Beat By: Diamond Style Productions Diamond Style Productions: http://www.soundclick.com/bands/default.cfm?bandID=749451 Contact Krispy Kreme's Manager: brettcaldwell2165@gmail.com"
"PMD5FS20tTY","3 Cats, 1 Steak","892547","Comedy","251","2009-10-05T15:42:15.000Z","01/18/13","4.7709804","5.0","1.0","3825","219","3606","BluVjdJJWXzLvlffTGIFPg","sosrevolution","https://gdata.youtube.com/feeds/api/users/sosrevolution","3 chats, 1 steak... Morale de la vidéo:  au milieu! Toujours au milieu! "
"pTUtETu09oQ","Norm Gets Mad At All The Haters On YouTube,  Biggest Freakout Ever Rant","1764769","People","123","2009-08-05T00:54:46.000Z","01/18/13","4.190845","5.0","1.0","33556","6788","26768","rREVpQ29EfMq092yEe0Elg","NormsBarStool","https://gdata.youtube.com/feeds/api/users/NormsBarStool","Get your Don't Call Me Fat t-shirt http://shoppeacefullife.com/dontcallmefat.html  I am pissed off and tired of all of the people on YouTube who make comments about how much they hate me and how fat I am.  Don't Call Me Fat!!!!!!!!!  Actually I am just kidding around.  Every comment is a good comment.  I love negative comments and love even more good positive comments.    Please subscribe whether you hate me or like me.    I love everyone who watches my videos.  Thanks for caring.    THANKS COLLEGEHUMOR FOR PUTTING ME ON YOUR FRONT PAGE TODAY 8/20/09!!!! SO FUCKING AWESOME!!!!!!  NUMBER ONE ON BREAK TODAY 8/21/09, SHIT THIS IS REALLY FUCKED UP.  THANKS FOR WATCHING!!!!! IF YOU LIKE PLEASE SUBSCRIBE.  Thank you RayWilliamJohnson for featuring me in your video.  I always enjoyed watching your videos until you blocked me.  Can you guys please message him and tell him to unblock me so I can subscribe to his videos again and tell him thanks.    Thanks everyone for watching and commenting!!!!  Keep on hating motherfuckers"
"PWhxCB0ndJE","DEATH METAL PARROT","6708509","Animals","39","2009-06-03T19:19:20.000Z","01/18/13","4.9460444","5.0","1.0","41664","562","41102","dBWisawEZcsO02j_G6rV2g","tuberbru","https://gdata.youtube.com/feeds/api/users/tuberbru","Hey fellow deathmetal parrot lovers, need you help & im using my youtube account as a last resort!!! This is a massive festival that I WANT TO WIN tickets for. There is no log in or registration, just click & vote. Simply & will take 1 min. PLEASE vote for Simone Jordan http://www.thenightlife.co.za/synergy-live-full-weekend-pass-giveaway/ MUCH APPRECIATE IT. Thanks all"
"PzQadza_vlA","newfie drinkin","791685","People","16","2006-10-30T04:31:18.000Z","01/18/13","4.9100204","5.0","1.0","2934","66","2868","3DsvInZPHRbfZjTsTc9uQQ","tuffdave","https://gdata.youtube.com/feeds/api/users/tuffdave","newfie drinkin"
"Q2iHj5q0yUc","Liquid Smoke in a Glass","2996689","Entertainment","51","2011-01-18T09:46:58.000Z","01/18/13","4.933146","5.0","1.0","13163","220","12943","1CUdDdLLAjXIJhDYRfavtg","noncents","https://gdata.youtube.com/feeds/api/users/noncents","Smoking trick requires: One unfiltered roll up and a cold glass.   Don't inhale the smoke just pull it into your cheeks and let it fall out your mouth along the inside of the tilted glass. Do not breathe as you do this or it will blow it all away! Practice makes perfect ... btw too much practice also causes oral cancer :s ... smoking kills! :o"
"Q5im0Ssyyus","Charlie The Unicorn","64990192","Comedy","225","2006-05-01T00:27:08.000Z","01/18/13","4.677481","5.0","1.0","287884","23212","264672","faj6AmlbQjR5QTRD0R6wsA","Geoff Swanson","https://gdata.youtube.com/feeds/api/users/gswanson17","Charlie Goes To Candy Mountain Made by TypeQueen of NewGrounds and SecretAgentBob on Youtube."
"qaIFr3M67vI","360 Flip Off Motorcycle","526404","Comedy","71","2010-10-16T23:07:03.000Z","01/18/13","4.973303","5.0","1.0","4345","29","4316","0CHjg5Klpym5kkPiEVmIiA","halimbb","https://gdata.youtube.com/feeds/api/users/halimbb","free games  http://musiquetub.blogspot.com/2012/01/angry-birds-ice-cream.html http://musiquetub.blogspot.com/2012/01/angry-birds-ice-cream.html http://musiquetub.blogspot.com/2012/01/angry-birds-ice-cream.html"
"qBqZ62JpgHo","S&W 500 Magnum Vs. Swimming Pool","678954","Entertainment","30","2011-08-12T07:44:39.000Z","01/18/13","4.7771134","5.0","1.0","3679","205","3474","RFI_LbHWsiN7OqqSRyTknw","AIKlDO","https://gdata.youtube.com/feeds/api/users/AIKlDO","I just posted an extended version with extra footage, slow motion and freeze frames. Check it out: S&W 500 Magnum Vs Swimming Pool - Directors Cut"
"QH2-TGUlwu4","Nyan Cat [original]","91420965","Comedy","217","2011-04-06T03:21:59.000Z","01/18/13","4.740709","5.0","1.0","746080","48363","697717","3VHfy8e1jbDnT5TG2pjP1w","saraj00n","https://gdata.youtube.com/feeds/api/users/saraj00n","For PJ.  Check out Nyan Cat at http://nyan.cat/ Official Nyan Cat Facebook: http://www.facebook.com/NyanCatWorld Nyan Cat on Twitter: https://twitter.com/nyannyancat  Nyan Cat Store: http://nyancat.cat/store.html  GIF by PRguitarman http://www.prguitarman.com/index.php?id=348 Song by Daniwell-P/Momone Momo UTAU http://momolabo.lolipop.jp/nyancatsong/Nyan/ ***used with permission; I own neither***"
"qhFXb6OJh_w","Walter Pandiani","918765","Sports","538","2011-09-23T14:57:46.000Z","01/18/13","4.8052506","5.0","1.0","2095","102","1993","lywhnD01yUU5kO6OgAeHUQ","EspanyolTV","https://gdata.youtube.com/feeds/api/users/EspanyolTV","23/9/11 Roda de premsa.  23/9/11 Rueda de prensa."
"qJjeG4ZFn6E","Baby Otter Sidney playing","963724","Animals","305","2009-07-13T05:49:21.000Z","01/18/13","4.9291706","5.0","1.0","4292","76","4216","Dun0HLDaXwB1Yf7A8ITBkQ","Misspippylou","https://gdata.youtube.com/feeds/api/users/Misspippylou","Sidney the baby asian small clawed river otter playing. Sidney is not a pet. I am a professional animal caretaker and work at Six Flags Discovery Kingdom in Vallejo, CA. Otters do not make good pets and are illegal to﻿ own personally. I'm glad you enjoy watching him! Music:  Xavier Rudd  White Moth  and Fisher  Beautiful Life "
"qlTNzMZEWno","Black Kid At A Rave","566846","Film","131","2012-07-27T04:10:46.000Z","01/18/13","4.933821","5.0","1.0","6286","104","6182","_oc-Acp4HQt_i7EXvpJn4g","murimew","https://gdata.youtube.com/feeds/api/users/murimew","original video: http://vimeo.com/9373087"
"qoP1N0OyFic","Surfer Almost Swallowed by Whale","9404613","Animals","39","2011-11-02T20:41:07.000Z","01/18/13","4.7013307","5.0","1.0","11424","853","10571","kvS2ITaGHm4YowQwOcoFZw","bqnbarb13","https://gdata.youtube.com/feeds/api/users/bqnbarb13","A woman floating on a surfboard near Santa Cruz, California almost ended up on the lunch menu for a humpback whale over the weekend. Barb Roettger had her camera rolling as two hefty whales popped out of the calm waters not far from the unsuspecting surfer and a pair of kayakers.  A pod of humpback whales has been hanging out off the Santa Cruz coast, noshing on anchovies that flock to the area to feed on plankton. The woman found herself in the middle of a feeding frenzy called lunge feeding, which occurs when whales herd anchovies and shoot straight up out of the water with their mouth wide open to catch the fish.   The whales have had quite a few dangerous close encounters with humans and boats in recent months. Whale watchers are warned to stay at least 100 yards away from the feeding area which can be a quarter mile square. Roettger says she has now gained a greater respect for whales, their feeding patterns and will now only spectate from the decidedly safer dry land.  For those who doubt that this is real, watch this footage that is shot from the same kayak:  http://www.youtube.com/watch?v=QHOQSRPYQWw  Looking to join a naturalist led sea kayaking tour in Santa Cruz, Moss Landing, Baja, Belize and beyond?         Contact Blue Water Ventures: http://www.bluewaterventures.org This story broke on Holy Kaw: http://holykaw.alltop.com/surfer-almost-swallowed-by-whale Read more at: http://holykaw.alltop.com/close-encounter-kayaking-with-the-humpback-wh"
"QOVxr3RPQwQ","Lady trips and falls during live news broadcast","793297","News","22","2010-12-07T07:10:02.000Z","01/18/13","4.6772084","5.0","1.0","917","74","843","fvn_YcBWBJRsQMG1ydUHWg","augustojr","https://gdata.youtube.com/feeds/api/users/augustojr","reporting on catholic church/school robbery in Bedford Park, Bronx as woman trips and falls. He looks behind him.   Our Lady of Refuge"
"qRUan6Evr0g","Dad Launches Daughter off Bed: ORIGINAL (Ally's Close Call) 2/26/11","721913","Comedy","26","2011-02-26T14:59:36.000Z","01/18/13","4.7283487","5.0","1.0","1605","109","1496","H96wXPfoh45Ks12fCI4-Ig","xmarjoex","https://gdata.youtube.com/feeds/api/users/xmarjoex","Dad jumps on the air mattress and launches Ally into the air! Please note that this is the ORIGINAL video clip, recorded by me (mom) and uploaded to this YouTube channel (xmarjoex). All other remix, shortened clips, etc here on YouTube were take without permission."
"QURja9e_EnQ","Fred Finds a Creepy Doll","11639935","Shows","191","2009-10-23T01:48:54.000Z","01/18/13","3.9714906","5.0","1.0","62681","16117","46564","KEXu8aCjrudFNx2jq9FfQw","Fred","https://gdata.youtube.com/feeds/api/users/Fred","A creepy doll shows up on Fred's doorstop and is full of nothing but EVIL!"
"qwyZ0ji1GRU","You aint got no pancake mix!","3484783","Comedy","45","2008-09-26T17:28:18.000Z","01/18/13","4.8225365","5.0","1.0","44967","1995","42972","0vGmCtKIBA7l0ptw_AyJYg","piscator11","https://gdata.youtube.com/feeds/api/users/piscator11","For the Shirts: http://youaintgotnopancakemix.viralprints.com  As for this video: I went up to one of the preacher ladies while her group was at GVSU preaching their 'Everyone's going to hell' nonsense. So I refuted everything they were saying, by shouting,  You aint got no pancake mix!  a hilarious one liner from my favorite comedian Zach Galifianakis.   ***Hey friends, in real life I am a photographer, here is my facebook page, please support me and click  like  and I will love you http://www.facebook.com/pages/Ars-Piscator-Photography/145657365515198"
"qybUFnY7Y8w","OK Go - This Too Shall Pass - Rube Goldberg Machine version - Official","38678751","Music","234","2010-03-02T05:52:34.000Z","01/18/13","4.947144","5.0","1.0","206069","2723","203346","194cPvPaGJjhJBEGwG6vxg","OkGo","https://gdata.youtube.com/feeds/api/users/OkGo","From the OK Go album  Of the Blue Colour of the Sky  available at http://www.okgo.net/store   Director: James Frost, OK Go and Syyn Labs.  Producer: Shirley Moyers.  The official video for the recorded version of  This Too Shall Pass  off the album  Of the Blue Colour of the Sky . The video was filmed in a two story warehouse, in the Echo Park neighborhood of Los Angeles, CA. The  machine  was designed and built by the band, along with members of Syyn Labs ( http://syynlabs.com/ ) over the course of several months.  There is an in-depth behind-the-scenes look at the warehouse here: http://www.okgo.net/this-too-shall-pass-rube-goldberg-machine/ OK Go thanks State Farm for making this video possible."
"R_B1PkgA3kA","Girl swallowed by pavement in China","3370816","Entertainment","95","2012-04-24T06:42:51.000Z","01/18/13","4.786161","5.0","1.0","4639","248","4391","PgLNge0xqQHWM5B5EFH9Cg","telegraphtv","https://gdata.youtube.com/feeds/api/users/telegraphtv","A cab driver comes to the rescue of a young girl after she falls into a sinkhole under a pavement in the city of Xi'an in northern China.  A surveillance camera catches the moment an unsuspecting girl falls through a pavement while walking down a street in northern China.  The pavement caved in under the teenager's weight as soon as she stepped onto a section of the walkway.  What followed was a dramatic rescue attempt by a passing taxi driver. His heroic actions were also filmed by close circuit television and on mobile phones.  The passing cab driver stopped immediately at the scene and climbed into the six-metre deep pit to help the girl.   I called out to her but she didn't respond. After I shook her a little, she came to,  said Wang Wei, a taxi driver in the northern city of Xi'an.  Read more about the rescue here: http://www.telegraph.co.uk/news/worldnews/asia/china/9222594/Girl-rescued-after-falling-through-pavement.html   Get the latest headlines http://www.telegraph.co.uk/  Subscribe to The Telegraph http://www.youtube.com/subscription_center?add_user=telegraphtv  Like us on Facebook http://www.facebook.com/telegraph.co.uk Follow us on Twitter https://twitter.com/telegraph Follow us on Google+ https://plus.google.com/102891355072777008500/  Telegraph.co.uk and YouTube.com/TelegraphTV are websites of The Daily Telegraph, the UK's best-selling quality daily newspaper providing news and analysis on UK and world events, business, sport, lifestyle and culture."
"r_Ua8iOR0g8","Shithead","2940692","Entertainment","113","2010-10-23T02:55:53.000Z","01/18/13","4.5042815","5.0","1.0","27209","3372","23837","Tu82QwOnouLvBrc1-00JWg","thankscomputer","https://gdata.youtube.com/feeds/api/users/thankscomputer","http://itunes.apple.com/us/album/im-s-d/id478894349?i=478894354  Download  I'm Shithead  on iTunes NOW AND SAVE YOUR DUMB LOVE LIFE.  -Shithead  www.weneedlovetoo.com (We see someone took this url, we aren't associated with them)  Thanks, Computer! Email us at thankscomputer@gmail.com for collaboration ideas, we love the support and are always working on new films! If you're over 18 and female you should just send naked pictures of yourself.  FOLLOW THANKS, COMPUTER! ON FACEBOOK: http://www.facebook.com/pages/Thanks-Computer-Productions/363957590736"
"R55e-uHQna0","The Force: Volkswagen Commercial","55786900","Autos","62","2011-02-02T13:54:57.000Z","01/18/13","4.9318275","5.0","1.0","216158","3684","212474","5vFx0GahDIWLMFm5j2_JZA","Volkswagen","https://gdata.youtube.com/feeds/api/users/Volkswagen","A pint-sized Darth Vader uses the Force when he discovers the all-new 2012 Passat in the driveway. This award-winning commercial first aired during the 2011 Big Game. Watch our 2012 Game Day commercial here: http://vwoa.us/dogstrikesback"
"r6tlw-oPDBM","Guiness World Record for most T-Shirts worn at one time.","17033564","Comedy","86","2006-09-28T13:08:27.000Z","01/18/13","4.602633","5.0","1.0","27803","2762","25041","-MiQIitPKEs5puuW9BvrLA","3ToeOne","https://gdata.youtube.com/feeds/api/users/3ToeOne","http://www.youtube.com/watch?v=fN1NXTuLaTA"
"RA3_Ty3U29I","Jealous alpha male monkey  attacks  man","3531987","People","34","2012-02-16T21:04:50.000Z","01/18/13","4.939558","5.0","1.0","15155","229","14926","xlVLxTI0q2W6NgiG_UmnzQ","Nathan Rucker","https://gdata.youtube.com/feeds/api/users/NRucker5","This is at the cafe inside the Memphis Zoo. The manager of the cafe told me that the alpha male monkey noticed me the second I walked in the door and started going crazy, because, as the alpha male, he feels threatened by tall males. So she told me to go stand by the window and turn my back on him and that he would  attack  me..."
"RI-l0tK8Ok0","Mayo Clinic atrium piano, charming older couple...","8359502","People","75","2008-09-25T00:29:13.000Z","01/18/13","4.971604","5.0","1.0","13523","96","13427","oCjoLFaiBhCozycc-SbySw","jodihume","https://gdata.youtube.com/feeds/api/users/jodihume","Fran & Marlo Cowan (married 62 years in 2008 when this was taken) playing impromptu recital together in the atrium of the Mayo Clinic. To read more about the day we took this lovely video http://sharing.mayoclinic.org/2009/04/23/a-bite-of-life/ The song is Old Grey Bonnet"
"rIX_6TBeph0","Ravenmania - Nevermore!","527529","Animals","106","2010-03-14T21:45:13.000Z","01/18/13","4.906243","5.0","1.0","4437","104","4333","1gj6Goynw8G7YoDVTWu4UA","inxcapable","https://gdata.youtube.com/feeds/api/users/inxcapable",""
"rOhgMAOrp0c","2x4 through my windshield...","4000400","People","40","2011-04-02T22:54:20.000Z","01/18/13","4.9056354","5.0","1.0","14285","337","13948","pEuSiSTsr_1gFb1tBlvNuA","Wendy Cobb","https://gdata.youtube.com/feeds/api/users/WendyCobb","**Comments back on** Not going to sweat the trolls from now on. To answer the questions, I was videoing two trucks that were holding up traffic, was using my iPhone, and had the phone pointed to the trucks, but I was watching the road. It's not like a camcorder where you have to look into the viewfinder people, think about it before you say something ignorant. Thanks for all the positive feedback - and to =3 for making me laugh, you are hilarious.  Ok- so I only posted this video because my son wanted to see if we could get 1,000 hits. And I thought maybe having a little fun with it might help me deal with it too. I disabled comments because people were being so incredibly mean. So far I've been accused of faking it (really?), been blamed for everything from the high price of gas global warming, and it was getting out of hand. Believe it or don't, it really did happen. Analyze the why's and how's if you need to, but I only thought it was an incredible dose of reality and that people would be shocked to see it. And really people, why in the world would you have to be so hateful???         Pay attention at the 30 second mark. No- it wasn't an April Fools joke, it really happened, and I was fine."
"rP-KFnYg6Hw","Joe Jonas Dances to Single Ladies","29065668","Music","245","2009-06-03T13:03:54.000Z","01/18/13","4.248113","5.0","1.0","184948","34765","150183","FvXnyAhluG3sa6p3eOs_LA","JonasBrothersMusic","https://gdata.youtube.com/feeds/api/users/JonasBrothersMusic","For our 2 Week COUNTDOWN to our 2009 Album Release, here is the long-awaited and long-requested video of Joe Jonas dancing to Single Ladies!  The Jonas Brothers' new album,  Lines, Vines, and Trying Times  is out on June 16th!"
"RP4abiHdQpc","Baby Laughing Hysterically at Ripping Paper (Original)","53033051","Comedy","104","2011-01-25T00:15:34.000Z","01/18/13","4.9173603","5.0","1.0","178849","3695","175154","tIbNdzSZ-mSqiTyIYsWiQA","BruBearBaby","https://gdata.youtube.com/feeds/api/users/BruBearBaby","8-month-old Micah (a boy) laughing hysterically while at-home daddy rips up a job rejection letter.  Check out the other  Baby Laughing Hysterically  videos of my son on my channel!  brubearbaby@gmail.com"
"RtT9X4eT_Ss","Dog afraid of Julia Roberts.AVI","1358242","Animals","37","2011-10-01T02:25:09.000Z","01/18/13","4.957791","5.0","1.0","11372","120","11252","GJxoZJks7orkx4pkIOaCUA","Keyla Q","https://gdata.youtube.com/feeds/api/users/KkQq0187","So we're sitting back watching TV when I see my dog flip out over something he saw on the pages of brides magazine (which I was reading at the time)....low and behold....a picture of Julie Roberts just so happened to scare my dog.......I told my fiance who was sitting right next to me, and he told me to grab the camera to film it.So I did, and we posted to friends and family alike (P.S. THAT IS NOT A TOWEL HE'S WEARING...IT IS A THROW BLANKET.Thanks for the comments!"
"rTUwqxHpXMY","Android on crack..lol (he was at Google I/O 2011,more of him in the description)","3560168","Entertainment","145","2011-03-21T04:00:52.000Z","01/18/13","4.970219","5.0","1.0","33310","248","33062","diceZgdYGRxWlkmia7XHEw","dark32","https://gdata.youtube.com/feeds/api/users/dark32","This was taken near 101 tower at new Sony Xperia Arc cellphone stand in Taiwan.  The background music in here : http://www.youtube.com/watch?v=Bx_ZYqH_G_c  Pictures of the the Hostess and other show girls here : http://www.flickr.com/photos/dark32/sets/72157626361558360/  More of him in here: http://www.youtube.com/watch?v=Df4yrimXCdY http://www.youtube.com/watch?v=8FMjh7swkts  Cheaper version of the Android: http://www.youtube.com/watch?v=7wesPnrgocM  At the Google I/O 2011 http://www.youtube.com/watch?v=tNST7wcwBvA&eurl=unknown&feature=player_embedded  More﻿ of him in Taiwan：  會跳熱舞的ANDROID youtube.com/watch?v=DzjzQNLOWv­8  超活潑Android公仔! youtube.com/watch?v=ice_Sg33rQ­g  公仔熱舞～超酷的～～～～ youtube.com/watch?v=1Y9hdNVbAk­s  小綠真人公仔街頭熱舞 youtube.com/watch?v=8mSZa6C8_W­I"
"rTZXRS0a51o","Drunnk Santa roof jump mishap.","631514","Comedy","111","2006-11-07T22:37:13.000Z","01/18/13","4.7247705","5.0","1.0","872","60","812","0V9vLm1zaRl-vrbwZYHFvw","8608388","https://gdata.youtube.com/feeds/api/users/8608388","I am a drunk Santa who decides to make an entrance by jumping off my garage roof on to my old Chevy suburban, While my quite large family awaits......Well it doesn't work quite how I planned....Very Funny! watch part 2, even funnier"
"rynvewVe21Y","Cat and Dolphins playing together","5513839","Animals","110","2011-03-06T22:08:43.000Z","01/18/13","0.0","0.0","0.0","0","0","0","B4c6cn3MOwwl0OBDr--WbQ","n24our","https://gdata.youtube.com/feeds/api/users/n24our","Cat and Dolphin playing together.   Theater of the Sea, a marine animal park in Islamorada, Florida in 1997. The dolphins are Shiloh and Thunder and the cat is Arthur. http://www.theaterofthesea.com/"
"s_xKK6beECU","Funny Camel Must See بعير دلوع لازم تشوفه","1221828","Animals","24","2010-03-18T21:47:17.000Z","01/18/13","4.8697724","5.0","1.0","3778","123","3655","NY17PHFpmjYKpOzMHVHfhQ","turkytube","https://gdata.youtube.com/feeds/api/users/turkytube","بعير يغار من اباطه هههههه hilarious ticklish camel got tickled under his arm , guess what !! happy lol"
"S0-z5ywDc0A","Table Jump Fail","958127","Comedy","6","2011-10-26T11:41:28.000Z","01/18/13","4.7670455","5.0","1.0","2816","164","2652","zKYJYojY8BvzQ7R1nTwu4Q","glebsterinc","https://gdata.youtube.com/feeds/api/users/glebsterinc","Parkour gone wrong.  http://www.facebook.com/glebsta LIKE US! http://WWW.GLEBSTA.COM - THE GOLD STANDARD"
"S2HIda5wSVU","THE TWILIGHT SAGA: ECLIPSE - Trailer","20233356","Film","93","2010-03-11T13:28:09.000Z","01/18/13","4.5360026","5.0","1.0","36914","4282","32632","ilIp91ZEYtKE7_gV07rrvA","OfficialTwilightFilm","https://gdata.youtube.com/feeds/api/users/OfficialTwilightFilm","In THE TWILIGHT SAGA: ECLIPSE, Bella once again finds herself surrounded by danger as Seattle is ravaged by a string of mysterious killings and a malicious vampire continues her quest for revenge.  In the midst of it all, she is forced to choose between Edward and Jacob — knowing that her decision has the potential to ignite the struggle between vampire and werewolf.  With her graduation quickly approaching, Bella is confronted with the most important decision of her life.  THE TWILIGHT SAGA: ECLIPSE opens on June 30, 2010.  Check out more at http://eclipsethemovie.com/"
"S2oymHHyV1M","Mountain Biker gets taken out by BUCK - CRAZY Footage - Only in Africa","14444975","Sports","75","2011-10-10T11:34:28.000Z","01/18/13","4.887739","5.0","1.0","30536","857","29679","hwnRsUket12tSDS9LSGmEw","mcsmcc","https://gdata.youtube.com/feeds/api/users/mcsmcc","Mountain Biker gets taken out by BUCK - Crazy Footage - Only in Africa, Mountain Biker, Mountain biker gets taken out by antelope, Evan van der Spuy of Team Jeep South Africa got taken out by a RED HARTEBEES at the Time Freight Express MTB race at Albert Falls Dam. Check out this crazy footage which was taken by team mate Travis Walker on his GoPro Camera - The BUCK sure does STOP HERE with Evan van der Spuy aka #BUCKNORRIS"
"SEBLt6Kd9EY","Ducks blown off their feet by the wind","28535663","Animals","46","2010-11-08T01:31:53.000Z","01/18/13","4.7787824","5.0","1.0","94477","5225","89252","UCTwWbSQT1dMhNgRZhkY2A","derbydanx","https://gdata.youtube.com/feeds/api/users/derbydanx","How do a mother duck and her ducklings fare against strong wind?  Find out!  Subscribe to my channel: http://www.youtube.com/derbydanx"
"sh6oGwOMVeY","Blame it on alcohol....","2441280","Comedy","653","2009-10-07T03:36:25.000Z","01/18/13","4.7978196","5.0","1.0","6054","306","5748","8aZF74J3gskD3UKhyX1UOA","indibeegee","https://gdata.youtube.com/feeds/api/users/indibeegee",""
"SKRgktzRvZ0","A Frog Sitting on a Bench Like a Human","10232739","Animals","43","2012-04-23T12:45:35.000Z","01/18/13","4.661433","5.0","1.0","48723","4124","44599","FgjC1wmRXyeMjjG9Br9OVw","RoltonB","https://gdata.youtube.com/feeds/api/users/RoltonB","What a Wonderful World http://www.youtube.com/watch?v=ZWRB6dfME7Y Hello My Baby, Hello My Honey, Hello My Ragtime Gal http://www.youtube.com/watch?v=zCC1BHXYh8s Never seen nothing like this before. The video was shot entirely fortuitously. The frog is OK. There is no nails, no glue, animal abuse, etc. Later, he jumped off the bench and galloped away to the water. More information: Bullfrog http://en.wikipedia.org/wiki/Bullfrog Bullfrogs back: http://madmikesamerica.com/wp-content/uploads/2011/08/Bullfrog1CBrown_altLG.jpg http://www.leaps.ms/greenfrogpage.jpg"
"SRLZk2Rik0c","pompフクロウ","871566","People","107","2011-03-06T03:19:36.000Z","01/18/13","4.981691","5.0","1.0","7428","34","7394","_qsPeG6g5fZ5WULn-ggF5A","yuriko914","https://gdata.youtube.com/feeds/api/users/yuriko914",""
